id,title,num_comments,score,upvote_ratio,domain,gilded,num_crossposts,nsfw,author,subreddit
1fz63ap,Opinion | I’m a Doctor. ChatGPT’s Bedside Manner Is Better Than Mine. (Gift Article),1,5,0.69,nytimes.com,0,0,False,nytopinion,Health
1fy6unh,Vance says a future Trump administration would defund Planned Parenthood,38,542,0.96,nbcnews.com,0,0,False,nbcnews,Health
1fyitnq,Frequent drinking of fizzy beverages and fruit juice linked to an increased risk of stroke: research,20,108,0.9,ctvnews.ca,0,0,False,CTVNEWS,Health
1fynscm,"Arm position during blood pressure check may lead to wrong reading, study finds",6,45,0.97,nbcnews.com,0,0,False,kirby__000,Health
1fyl8as,CDC to begin testing travelers from Rwanda for deadly Marburg virus,1,43,0.97,nbcnews.com,0,0,False,nbcnews,Health
1fy8pnu,Opinion | Anthony Fauci: A Mosquito in My Backyard Made Me the Sickest I’ve Ever Been (Gift Article),11,146,0.94,nytimes.com,0,0,False,nytopinion,Health
1fy3xbw,Women missing work due to painful periods and endometriosis costing UK €13 billion a year,36,297,0.92,euronews.com,0,1,False,euronews-english,Health
1fy80uz,Vegetable Recall Update: Warning for State As FDA Sets Highest Risk Level | The vegetable products were recalled due to a possible contamination with the bacteria Listeria monocytogenes.,15,136,0.96,newsweek.com,0,0,False,chrisdh79,Health
1fy7t2x,"Baby boomers living longer but are in worse health than previous generations | Obesity, type 2 diabetes, cancer, heart disease and other diseases all affecting people at younger ages, say experts",1,70,0.97,theguardian.com,0,0,False,chrisdh79,Health
1fy3rw8,"Medical debt snares millions of people. States, red and blue are passing laws to help",3,91,0.99,npr.org,0,0,False,Maxcactus,Health
1fy9s5t,"Golf cart injuries are on the rise and many involve children, experts warn",5,20,0.93,globalnews.ca,0,0,False,globalnewsca,Health
1fxfxly,Stem cells reverse woman’s diabetes — a world first,10,495,0.99,nature.com,0,1,False,Maxcactus,Health
1fyayn2,Human longevity may have reached its upper limit,8,3,0.56,scientificamerican.com,0,1,False,scientificamerican,Health
1fx11zp,FDA upgrades recall of eggs linked to salmonella to 'serious' health risks or 'death',7,190,0.97,usatoday.com,0,0,False,ThrillSurgeon,Health
1fxdxkv,Why an ADHD diagnosis can be a mixed blessing,1,14,0.86,bbc.com,0,0,False,Jojuj,Health
1fwtoha,"Black Plastic Cooking Utensils May Contain Banned Flame Retardants, According to New Study",49,461,0.99,eatingwell.com,0,0,False,TylerFortier_Photo,Health
1fy84ar,I'm a longevity expert. Two small changes can help men live longer,15,0,0.27,newsweek.com,0,0,False,newsweek,Health
1fwrekn,Death Has Two Timelines,15,253,0.95,theatlantic.com,0,0,False,theatlantic,Health
1fwip6q,Condoms aren’t a fact of life for young Americans. They’re an afterthought,55,274,0.93,apnews.com,0,0,False,newzee1,Health
1fw6rhg,"The US has passed peak obesity, a new survey suggests. Is it the Ozempic effect?",236,554,0.95,independent.co.uk,0,0,False,CharacterFennel1927,Health
1fw7uhq,US Federal Judge orders EPA to begin the process of strengthening fluoride regulations over findings of potential health issues for children's IQ levels.,64,433,0.96,theguardian.com,0,1,False,Lighting,Health
1fwnjoi,Storm damage closes N.C. factory that makes vital hospital supplies,0,25,0.92,npr.org,0,0,False,Maxcactus,Health
1fwlbwy,New Research Analysis Supports Further Testing of Eye Drops Hoped to Reverse Cataracts ,0,31,0.98,healthcare.utah.edu,0,0,False,thinkB4WeSpeak,Health
1fwrhe2,Vibrating plates are shaking up TikTok users workout routines — but what are the benefits?,8,7,0.73,the-independent.com,0,0,False,theindependentonline,Health
1fvz2l4,"Toddlers Get Half Their Calories From Ultra-Processed Food, Says Study | Research shows that 2-year-olds get 47 percent of their calories from ultra-processed food, and 7-year-olds get 59 percent.",122,406,0.97,newsweek.com,0,1,False,chrisdh79,Health
1fwb5jk,Scientists may have found the reason why people with schizophrenia hear voices,6,58,0.94,statnews.com,0,0,False,TylerFortier_Photo,Health
1fwkkcb,Bird Flu Fears Stoke the Race for an mRNA Flu Vaccine,1,11,0.91,wired.com,0,0,False,F0urLeafCl0ver,Health
1fwpipv,EU/EEA travellers advised to exercise caution when visiting Oropouche virus disease epidemic areas,0,3,1.0,ecdc.europa.eu,0,0,False,boppinmule,Health
1fvxrzl,Scientists in UK developing world's first ovarian cancer vaccine,1,142,1.0,euronews.com,0,1,False,euronews-english,Health
1fw8roj,"Is bird flu spreading in people? Without blood test results, officials can't say.",1,15,0.89,nbcnews.com,0,0,False,nbcnews,Health
1fwamhg,"CDC launches new way to measure trends of COVID, flu and more for 2024",2,13,0.88,cbsnews.com,0,0,False,CBSnews,Health
1fvz0aw,"‘Gamechanger’ HIV prevention drug to be made available cheaply in 120 countries | Gilead Sciences announces deal to manufacture generic versions of lenacapavir, but critics say it excludes many countries where incidence is highest",0,45,0.93,theguardian.com,0,0,False,chrisdh79,Health
1fvl41d,The profit-obsessed monster destroying American emergency rooms,19,548,1.0,vox.com,0,0,False,ThrillSurgeon,Health
1fve31i,"Ontario child dies from rabies after bat found in room, official says",234,1256,0.98,globalnews.ca,0,0,False,globalnewsca,Health
1fw4ho0,WHO approves first mpox diagnostic test,0,14,0.85,dw.com,0,0,False,DoremusJessup,Health
1fvkopg,Hospitals take steps to conserve IV fluid supply after Helene strikes critical factory,4,97,0.99,nbcnews.com,0,0,False,nbcnews,Health
1fviry2,"Flu vaccine might be less effective this year, new CDC report suggests",4,97,0.95,cbsnews.com,0,0,False,CBSnews,Health
1fvbeds,Two suspected German cases of deadly Marburg virus test negative in Hamburg,0,67,0.98,upi.com,0,0,False,progress18,Health
1fv08g4,Louisiana Reclassifies Abortion Pills as Controlled Dangerous Substances,60,244,0.96,meidasnews.com,0,0,False,newzee1,Health
1fvdata,From fruit fly to this guy: a map of one tiny brain may show how larger ones work,0,22,0.93,npr.org,0,0,False,npr,Health
1fvebnc,Why fears of human-to-human bird flu spread in Missouri are overblown ,2,14,0.75,wapo.st,0,0,False,washingtonpost,Health
1fuu334,Marburg virus feared in Germany as two hospitalised,40,385,0.98,au.news.yahoo.com,0,0,False,progress18,Health
1fv3usy,Doctor charged in Matthew Perry case pleads guilty to conspiracy to dispense ketamine,0,55,0.94,npr.org,0,0,False,Maxcactus,Health
1fvl5ql,Could Rapamycin Be the Secret for Anti-Aging?,1,0,0.48,insideedition.com,0,0,False,insideedition,Health
1fvkzhe,Ghana reports first mpox case but variant not yet clear,0,1,1.0,reuters.com,0,0,False,LosFelizCB,Health
1fuirv3,A Hospital Kept a Brain-Damaged Patient on Life Support to Boost Statistics. His Sister Is Now Suing for Malpractice.,11,257,0.99,propublica.org,0,0,False,Exastiken,Health
1fv4r5u,"England launches genetic screening programme for 100,000 newborns",0,4,0.75,euronews.com,0,0,False,euronews-english,Health
1fumx2q,Marburg virus kills 8 in Rwanda. What to know about the Ebola-like outbreak and symptoms,2,52,0.97,cbsnews.com,0,0,False,CBSnews,Health
1fu6ccu,"Vance claims Trump 'salvaged' Obamacare. Trump tried, and failed, to kill it.",11,809,0.96,nbcnews.com,0,0,False,nbcnews,Health
1fuj8q3,The true death toll from hurricanes can take years to unfold,1,70,1.0,scientificamerican.com,0,0,False,scientificamerican,Health
1furdd2,Fly brain breakthrough 'huge leap' to unlock human mind,1,19,0.85,bbc.co.uk,0,0,False,Octopus-Pawn,Health
1futlk0,Was Missouri’s bird flu case a one-off or something more? Quest for answers faces testing delay,2,14,0.86,statnews.com,0,1,False,Nscience,Health
1funpyj,How COVID-19 Messes Up Your Gut Health,2,16,0.95,time.com,0,0,False,timemagazine,Health
1fuh4qc,How the 2024 election will affect IVF and abortion access,4,28,0.88,scientificamerican.com,0,0,False,scientificamerican,Health
1fukadl,Bright light therapy may work to treat non-seasonal depression,1,16,0.88,euronews.com,0,0,False,euronews-english,Health
