id,title,num_comments,score,upvote_ratio,domain,gilded,num_crossposts,nsfw,author,subreddit
1grfl90,"Trump picks RFK Jr. , anti-vaccine activist, for Health and Human Services secretary",249,757,0.89,nbcnews.com,0,3,False,nbcnews,Health
1grm4dj,"Want to live an extra 5 years? Those over 40 should exercise like this every day, researchers say",53,194,0.93,cbsnews.com,0,1,False,wonderingsocrates,Health
1grifuq,"With Trump coming into power, the NIH is in the crosshairs",24,178,0.97,npr.org,0,0,False,newzee1,Health
1grkkal,"Winter Haven commissioners vote to remove fluoride from water, citing RFK Jr.",62,130,0.92,wfla.com,0,0,False,newzee1,Health
1gru3ix,The First Crispr Treatment Is Making Its Way to Patients,1,14,0.95,wired.com,0,0,False,wiredmagazine,Health
1grtoqr,Opinion | Can America’s Health Survive Robert F. Kennedy Jr.? (Gift Article),17,11,0.71,nytimes.com,0,0,False,nytopinion,Health
1gr7zzq,"Americans Began Drinking More During the Pandemic, and They Haven’t Stopped",59,381,0.97,healthline.com,0,0,False,healthline,Health
1grax9v,"FDA employees consider how to handle RFK Jr., including leaving",48,234,0.98,nbcnews.com,0,1,False,nbcnews,Health
1gr4cq3,"Trump would like to bring back mental institutions, but experts are skeptical",151,443,0.95,npr.org,0,0,False,Maxcactus,Health
1grvmbc,How the CDC could change under the next Trump administration,0,5,0.86,npr.org,0,0,False,Maxcactus,Health
1grr44i,2 million seek treatment as smog chokes Punjab,0,6,0.81,dawn.com,0,0,False,boppinmule,Health
1grecei,There’s bird flu in California wastewater. What’s next?,9,52,0.93,scientificamerican.com,0,0,False,scientificamerican,Health
1gr7w2z,"Why do we feel better after a ""good cry""? An expert explains the science behind it.",11,48,0.86,cbsnews.com,0,1,False,CBSnews,Health
1gr67t9,Sleep Doctors Share the 1 Tip That's Changed Their Lives,13,55,0.95,time.com,0,0,False,timemagazine,Health
1grfl0y,"A breakthrough cancer immunotherapy is now taking aim at autoimmune disease | CAR-T therapy is generating excitement for lupus, scleroderma, and other conditions as clinical trials expand",0,13,0.94,science.org,0,0,False,Exastiken,Health
1gqq82c,McDonald's deadly E. coli outbreak has now sickened more than 100 people,16,399,0.99,cbsnews.com,0,0,False,CBSnews,Health
1gr6xec,What science really says on the link between organic food and health,3,16,0.77,lemonde.fr,0,0,False,LeMonde_en,Health
1grelcz,Model-driven Heart Rate Estimation and Heart Murmur Detection based on Phonocardiogram,0,6,0.81,ieeexplore.ieee.org,0,0,False,Diazepam,Health
1gqe27b,Robert F. Kennedy Jr. Reveals Plans to Fire 600 Federal Health Workers,257,1108,0.96,motherjones.com,0,0,False,newzee1,Health
1gqozwr,Federal lab confirms B.C. teen is first to contract bird flu in Canada,8,113,0.97,globalnews.ca,0,0,False,globalnewsca,Health
1gqg4in,"With a push from RFK Jr., baseless fears about fluoride go mainstream",116,314,0.89,statnews.com,0,0,False,statnews,Health
1gqr8ns,Canadian teen's bird flu infection is not the version found in cows,0,32,0.92,statnews.com,0,0,False,statnews,Health
1gqmpph,"8 Things You Should Do for Your Bones Every Day, According to Orthopedic Doctors",7,42,0.95,time.com,0,1,False,timemagazine,Health
1gr7ghe,Over 800 million people have diabetes globally. What about in Europe?,1,1,1.0,euronews.com,0,0,False,euronews-english,Health
1gq3h4a,Lunchables removed from national school lunch program,34,527,1.0,cnn.com,0,0,False,cnn,Health
1gqbrw7,What happens when a vaccine skeptic leads health policy? Ask Florida,3,82,0.94,npr.org,0,0,False,Maxcactus,Health
1gqc8be,"FDA Recalls Chronic Kidney Disease Medication Over Impurity Concerns | Nearly 300,000 bottles of the drug, named Cinacalcet, were recalled and given a Class II recall risk level by the FDA.",4,49,0.95,newsweek.com,0,0,False,chrisdh79,Health
1gpxbfa,Teenager in critical condition with Canada’s first human case of bird flu,51,448,0.98,theguardian.com,0,0,False,sorryDontUnderstand,Health
1gqkhuc,"Lizard spit can help detect a rare pancreatic tumor | A protein found in the saliva of Gila monsters can bind to certain cells in the pancreas, making it a potentially useful tracer for finding insulinomas",2,7,0.83,sciencenews.org,0,0,False,Science_News,Health
1gprw6c,Genetic Discrimination Is Coming for Us All,54,475,0.96,theatlantic.com,0,2,False,theatlantic,Health
1gqb229,Bone Marrow Donors Can Be Hard to Find. One Company Is Turning to Cadavers,1,14,0.86,wired.com,0,0,False,wiredmagazine,Health
1gppzdq,"Don’t sit on the toilet for more than 10 minutes, doctors warn",86,328,0.96,cnn.com,0,1,False,Rivinstein,Health
1gqccc9,Online yoga classes prove helpful for back pain in new study,1,9,0.85,npr.org,0,0,False,DonutBree,Health
1gq9lmg,"Opinion | How to Talk About Fluoride, Vaccines and Raw Milk (Gift Article)",6,6,0.73,nytimes.com,0,0,False,nytopinion,Health
1gqgqy4,Cell therapy shows promise in treating deadly childhood brain cancer,0,1,1.0,euronews.com,0,0,False,euronews-english,Health
1gpi8zm,Do you close the toilet lid when you flush? Bacteria from the loo could be reaching your toothbrush.,48,224,0.95,bbc.co.uk,0,0,False,uniofwarwick,Health
1gq70dp,Opinion | Light in the Shadow of a Diagnosis (Gift Article),1,6,1.0,nytimes.com,0,0,False,nytopinion,Health
1gpphdw,"Americans started drinking more during the pandemic, and a new study shows that lasted for years",4,63,1.0,cbsnews.com,0,0,False,CBSnews,Health
1gpo3up,Sudden syphilis retreat in gay men is most likely tied to preventive antibiotic use,2,40,0.91,nbcnews.com,0,0,False,nbcnews,Health
1gpiszc,The Real Problem With Banning Masks at Protests,2,25,0.83,wired.com,0,0,False,wiredmagazine,Health
1gozfvv,"Bleeding and in pain, a woman endured a harrowing wait for miscarriage care due to Georgia’s restrictive abortion law",77,569,0.92,cnn.com,0,1,False,cnn,Health
1gpvi1n,Cutting-edge test uses DNA sequencing to yield diagnoses for some medical mysteries,0,5,0.86,nbcnews.com,0,0,False,nbcnews,Health
1gptq8v,Mixed reality game may help kids be more active,1,3,0.72,news.uga.edu,0,0,False,universityofga,Health
1gpqw7o,Crosslinking of Ly6a metabolically reprograms CD8 T cells for cancer immunotherapy,0,6,0.81,nature.com,0,0,False,Yogurt789,Health
1gp45sj,Trump's Uncertain Health Plans,18,159,0.88,dcreport.org,0,0,False,Majano57,Health
1goru3d,More young people are surviving cancer. Then they face a life altered by it,56,462,0.99,npr.org,0,0,False,zsreport,Health
1goz7hb,This scientist treated her own cancer with viruses she grew in the lab,2,136,0.98,nature.com,0,0,False,F0urLeafCl0ver,Health
1gov1gy,Just 5 More Minutes of Vigorous Exercise Per Day Could Help Lower Blood Pressure,7,168,0.99,healthline.com,0,0,False,healthline,Health
1govb1x,Anti-aging enthusiasts are turning to the drug rapamycin to help extend their lives—can it work? A longevity doctor weighs in,9,68,0.89,cnbc.com,0,1,False,cnbc_official,Health
1gosp63,First human case of bird flu detected in Canada,7,69,0.96,newsweek.com,0,0,False,newsweek,Health
1goqeuc,Stanford Scientists Overturn Mendel’s Law With Cancer Discovery,7,99,0.99,scitechdaily.com,0,0,False,Maxcactus,Health
1gotll8,Brain aging: Green Mediterranean diet may help slow brain shrinkage,0,45,0.93,medicalnewstoday.com,0,0,False,DonutBree,Health
1go6fsv,RFK Jr.’s new bully pulpit sends public health shock waves,164,551,0.92,thehill.com,0,0,False,GoMx808-0,Health
1gowexi,When Should I Go To the Doctor With Cold Symptoms?,5,4,0.6,time.com,0,0,False,timemagazine,Health
1go2ce3,"The WHO called antimicrobial resistance “an increasingly serious threat to global public health that requires action across all government sectors and society."" Growing evidence suggests antibiotic resistance is largely caused by antibiotic use in animal agriculture. Veganism is a solution.",98,270,0.88,pmc.ncbi.nlm.nih.gov,0,0,False,H0w-1nt3r3st1ng,Health
1gpcp82,Opinion | Wellness Should be Just a Hobby (Gift Article),3,0,0.27,nytimes.com,0,0,False,nytopinion,Health
1gny59u,Virulent New “Super-Strain” of Bacteria Is Rapidly Spreading in Asia,91,411,0.97,scitechdaily.com,0,1,False,Maxcactus,Health
1gowilu,UK scientists testing chemical in red grapes to prevent bowel cancer,0,1,1.0,euronews.com,0,0,False,euronews-english,Health
1got0k6,"Ultra-processed foods may accelerate biological ageing, study finds",0,1,1.0,euronews.com,0,0,False,euronews-english,Health
1gnrm7o,"Weight loss drug Ozempic can affect muscle mass, study shows",82,195,0.93,thehill.com,0,0,False,DoremusJessup,Health
1gnqb47,HPV vaccination: How the world can eliminate cervical cancer,5,114,0.94,ourworldindata.org,0,0,False,F0urLeafCl0ver,Health
1gngi9t,RFK Jr.’s plan to ban fluoridation? Work’s already underway,136,388,0.94,politico.com,0,0,False,newzee1,Health
1gnccw3,Scary study finds over 1 billion young people are at risk of hearing loss for one reason,60,335,0.93,bgr.com,0,1,False,BothZookeepergame612,Health
1gnmjnr,Association Between Alzheimer's Disease and Herpes,7,68,0.97,herpescureadvocacy.com,0,1,False,Away_Repair7421,Health
1gnepde,A ‘Crazy’ Idea for Treating Autoimmune Diseases Might Actually Work,5,69,0.92,theatlantic.com,0,0,False,newzee1,Health
1gnm1ig,Opinion | A.I. Companions and the Mental Health Risks for the Young (Gift Article),1,9,0.82,nytimes.com,0,0,False,nytopinion,Health
1gmz2fx,‘Exciting’ new lupus treatment could end need for lifelong medication,4,248,0.99,theguardian.com,0,0,False,miolmok,Health
1gna1en,How to create a dopamine menu to combat fall and winter blues. ,0,4,0.67,cbsnews.com,0,0,False,UncoveringScandals90,Health
1gmootg,Federal judge’s ruling to reduce fluoride levels in drinking water despite ‘scarce’ research may help fuel RFK Jr.’s ‘wild’ crusade,45,200,0.88,lawandcrime.com,0,0,False,tasty_jams_5280,Health
1gmb7ol,Millions at risk of losing health insurance after Trump's victory,344,1354,0.89,nbcnews.com,0,0,False,newzee1,Health
1gmmy2g,What Trump and Robert F. Kennedy Jr. might do to undermine vaccines — and what they likely can’t,17,117,0.84,statnews.com,0,0,False,statnews,Health
1gmokyu,Study maps how nonprofit religious groups set up facilities near abortion clinics,1,39,0.89,nbcnews.com,0,0,False,nbcnews,Health
1gmfqd7,"After decades, FDA finally moves to pull ineffective decongestant off shelves | Last year, FDA advisors unanimously voted that oral phenylephrine is ineffective.",5,77,0.98,arstechnica.com,0,0,False,chrisdh79,Health
1gmgbgc,TB reclaims title of deadliest infectious disease. That's an 'outrage' says WHO,0,68,0.96,npr.org,0,0,False,Maxcactus,Health
1glvaea,Americans stockpile abortion pills and hormones ahead of ‘reproductive apocalypse’ under Trump,200,1367,0.94,theguardian.com,0,0,False,poltrudes,Health
1gmeegn,Seem like peanut allergies were once rare and now everyone has them?,15,66,0.89,news.harvard.edu,0,1,False,F0urLeafCl0ver,Health
1gmfj08,Swiss researchers find unwanted CRISPR side effects,1,41,0.94,swissinfo.ch,0,0,False,Realistic-Lie-8031,Health
1gm7r68,"Compounded semaglutide associated with at least 10 deaths, Novo Nordisk CEO warns",21,147,0.87,cnn.com,0,0,False,cnn,Health
1gm3j7c,America Has an Onion Problem,38,182,0.92,theatlantic.com,0,0,False,theatlantic,Health
1gluqc8,"FDA proposes ending use of decongestant found in many cold, allergy medicines",49,300,0.98,cnbc.com,0,0,False,cnbc_official,Health
1glxw7c,It's Safe to Get the COVID-19 and Flu Shots at the Same Time,42,75,0.84,time.com,0,0,False,timemagazine,Health
1glpl40,Best fluoride alternatives if it's removed from water?,201,180,0.85,nbcnews.com,0,0,False,nesp12,Health
1glzrod,"Bird flu infections in farmworkers are going undetected, study shows",3,46,0.94,statnews.com,0,1,False,statnews,Health
1gloctg,Robert F. Kennedy Jr.’s “Make America Healthy Again” Draws Wellness Influencers to MAGA,74,182,0.88,motherjones.com,0,1,False,newzee1,Health
1gm17rq,Inside the Company Helping America’s Biggest Health Insurers Deny Coverage for Treatments,0,23,0.88,propublica.org,0,0,False,rustyseapants,Health
1glun1n,"Toddler’s Snakebite Treatment Costs Family $297,000 | A recent report highlights how hospitals will often egregiously mark up the costs of antivenom.",3,24,0.83,kffhealthnews.org,0,0,False,chrisdh79,Health
1glov2d,'Forever chemicals' linked to gut and kidney damage in young adults,0,52,0.96,euronews.com,0,0,False,euronews-english,Health
1glo0nx,"Sugar in the first 1,000 days after conception linked to health issues later in life, study say",8,56,0.9,cnn.com,0,0,False,AndySplash,Health
1glujse,Energy drinks may be damaging your heart,11,21,0.79,futurity.org,0,0,False,Snowfish52,Health
1glqdkq,"Moderna posts surprise profit as Covid vaccine sales impress, cost cuts take hold",3,31,0.82,cnbc.com,0,0,False,cnbc_official,Health
1gl5e6y,"After Trump win, RFK Jr. says he won't 'take away anybody’s vaccines'",182,963,0.95,nbcnews.com,0,0,False,nbcnews,Health
1gltaz1,"Sleepy during the day? You may be at higher risk for a pre-dementia syndrome, study finds",3,14,0.82,ctvnews.ca,0,0,False,CTVNEWS,Health
1gl78sz,States’ Abortion Rights Wins May Be Short-Lived Under a Second Trump Term,72,422,0.93,wired.com,0,0,False,wiredmagazine,Health
1gla05e,5 ways Trump’s presidential win could change U.S. health care,78,201,0.91,globalnews.ca,0,0,False,globalnewsca,Health
1glrb3o,Pedaling Towards Happiness: 7 Mental Health Benefits of Riding Bikes,0,9,0.85,momentummag.com,0,0,False,Generalaverage89,Health
1glc31w,"Sleepy during the day? You may be at higher risk for a pre-dementia syndrome, study finds",10,83,0.9,cnn.com,0,1,False,cnn,Health
1glnzc4,"Preterm births linked to lower income, employment and education in adulthood, study finds",0,9,0.85,euronews.com,0,0,False,euronews-english,Health
1glsxkz,Inside Canada's chaotic response to bird flu,0,5,0.77,ctvnews.ca,0,0,False,CTVNEWS,Health
1gl6e0b,Higher omega-3 and omega-6 levels associated with lower rates of cancer,1,91,0.99,news.uga.edu,0,0,False,universityofga,Health
1glwr03,"James Van Der Beek of ‘Dawson’s Creek’ Reveals He Has Colon Cancer, Diagnosis Highlights Alarming Trend in Young People",0,1,1.0,healthline.com,0,0,False,healthline,Health
1gkvzm1,"Abortion rights ballot measures pass in 7 states, fail in 3 others",11,241,0.97,nbcnews.com,0,0,False,nbcnews,Health
1gl41tp,"The post-Roe effort to protect abortion rights hits its limit, for now",1,64,0.95,statnews.com,0,0,False,statnews,Health
1gl17xj,U.K. doctor gets 31 years for poisoning mother's partner with fake COVID vaccine,2,92,0.97,ctvnews.ca,0,0,False,CTVNEWS,Health
1gl08ut,Eye health: Eating 2 ounces of pistachios daily may help,4,32,0.95,medicalnewstoday.com,0,0,False,ChocoMuchacho,Health
1gkh3ax,Pfizer Accused of Hiding Birth Control Drug's Brain Tumor Link,16,501,0.98,news.bloomberglaw.com,0,0,False,bloomberglaw,Health
1glau47,Mindfulness meditation with Jon Kabat-Zinn,2,0,0.5,cbc.ca,0,0,False,sparki_black,Health
1gkhh09,Opinion | Election Uncertainty Has Broken Our Brains (Gift Article),2,54,0.9,nytimes.com,0,0,False,nytopinion,Health
1gjrfam,RFK Jr. and Trump want fluoride out of water. What does the mineral do?,220,697,0.94,globalnews.ca,0,1,False,globalnewsca,Health
1gjosec,"Seven Hours of Sleep Is the New Eight, Expert Says",62,310,0.87,healthnews.com,0,0,False,SscorpionN08,Health
1gjn1u0,A ‘Crazy’ Idea for Treating Autoimmune Diseases Might Actually Work,20,371,0.98,theatlantic.com,0,1,False,theatlantic,Health
1gjqqi8,The Deaths and Agonies of Trump’s Abortion Bans,1,187,0.96,nymag.com,0,0,False,marji80,Health
1gjk68u,"Sugar in the first 1,000 days after conception linked to health issues later in life, study says",15,274,0.91,cnn.com,0,1,False,cnn,Health
1gk2ht7,"Europe's food supply will be impacted by Spain's floods, warn experts",0,14,0.81,euronews.com,0,0,False,boppinmule,Health
1gjn4vp,Is election anxiety keeping you awake? Sleep experts share advice,25,121,0.92,scientificamerican.com,0,0,False,scientificamerican,Health
1gji7re,'Changed my life': This Canadian woman was struggling with multiple chronic health problems. A diabetes program changed everything,10,183,0.96,ctvnews.ca,0,0,False,CTVNEWS,Health
1gjjtc9,Opinion | Doctors Should Have to Report Medically Impaired Drivers (Gift Article),26,92,0.85,nytimes.com,0,0,False,nytopinion,Health
1gjitds,Winter depression is real and there are many ways to fight back,4,54,0.9,ctvnews.ca,0,0,False,CTVNEWS,Health
1gj7ll2,"Scientists glue two proteins together, driving cancer cells to self-destruct",12,348,0.99,med.stanford.edu,0,0,False,Snowfish52,Health
1gjegba,"New magnetoelastic sensor within a stent transmits information about potential bile blockages,",0,19,0.96,ece.engin.umich.edu,0,0,False,mareacaspica,Health
1gip725,Scientists found a new way to make cancer cells self-destruct,13,524,1.0,bgr.com,0,0,False,BothZookeepergame612,Health
1giw6fv,Presidential candidates silent on opioid crisis beyond ‘war on drugs’ rhetoric: ‘It’s easier to point fingers,20,109,0.91,theguardian.com,0,0,False,shinybrighthings,Health
1gibzm9,"Dentists Are Pulling ‘Healthy’ and Treatable Teeth To Profit From Implants, Experts Warn ",65,694,0.97,kffhealthnews.org,0,0,False,mcgillhufflepuff,Health
1giiz54,"Toxic PFAS in menstrual pads harm reproductive health, advocates says",3,150,0.98,theguardian.com,0,0,False,rhs314,Health
1gjc3m5,AI chatbot blamed in teen's death: Here's what to know about AI's psychological risks and prevention,0,1,1.0,euronews.com,0,0,False,euronews-english,Health
1giui2r,Govt shuts primary schools in Lahore over record pollution,1,19,0.89,dawn.com,0,0,False,boppinmule,Health
1gicemb,"In a 1st, scientists reversed type 1 diabetes by reprogramming a person's own fat cells | Live Science",4,290,1.0,livescience.com,0,0,False,Southern_Opposite747,Health
1gicexo,Largest cancer atlas to date brings new treatments for incurable tumors closer,0,91,1.0,english.elpais.com,0,0,False,DoremusJessup,Health
1gi7n78,Mother warns about SUDEP after son’s death,5,68,0.96,katu.com,0,0,False,sullie363,Health
1ghuc8q,Everything you ever wanted to know about vaginas … but were too afraid to Google,28,246,0.89,theguardian.com,0,0,True,F0urLeafCl0ver,Health
1ghv3cz,Can retraining the brain help silence tinnitus? Some scientists are trying to find out,18,123,0.98,cbc.ca,0,1,False,sparki_black,Health
1gi5rua,Watch: Herald investigation reveals illegal $3 cigarettes sold in Auckland dairies,0,22,0.85,nzherald.co.nz,0,0,False,boppinmule,Health
1ghq8fd,An Idaho health department isn't allowed to give COVID-19 vaccines anymore. Experts say it's a first,5,135,0.96,apnews.com,0,0,False,marji80,Health
1gh9h49,A Pregnant Teenager Died After Trying to Get Care in Three Visits to Texas Emergency Rooms,150,978,0.97,propublica.org,0,0,False,Exastiken,Health
1ghu7fw,An 'unprecedented' good news story about a potentially deadly viral outbreak,0,24,0.88,npr.org,0,0,False,Maxcactus,Health
1ghdl5a,RFK Jr. Is Already Preparing to Take Over Federal Health Agencies,54,374,0.95,rollingstone.com,0,0,False,indig0sixalpha,Health
1ghtlc1,"Endocrine disruptors, the invisible chemicals that trigger disease",1,22,0.9,english.elpais.com,0,0,False,miolmok,Health
1ghaf4u,Texas hospitals must now ask patients whether they’re in the US legally.,298,489,0.95,cnn.com,0,1,False,mattv911,Health
1ghf8zt,"A quarter of pediatric deaths at hospitals are preventable, study finds",3,164,0.98,independent.co.uk,0,0,False,theindependentonline,Health
1ghcumv,Trump team fully embraces RFK Jr.'s vaccine skepticism,22,212,0.91,nbcnews.com,0,0,False,nbcnews,Health
1ghfco5,Salad recall in five states over allergen fears,1,49,0.96,newsweek.com,0,0,False,newsweek,Health
1gh7qx2,Children's doctors reporting unusual increase in walking pneumonia cases in Canada,7,113,0.97,ctvnews.ca,0,0,False,CTVNEWS,Health
1gh88wq,"Bird flu spreading faster than 2023 in the EU, data shows",0,47,0.99,ctvnews.ca,0,0,False,CTVNEWS,Health
1gglbbv,Trump transition official says RFK Jr. wants to force vaccines off the market,136,1038,0.94,thehill.com,0,2,False,marji80,Health
1ggnvdj,"Parents are putting more trust into ChatGPT than actual doctors, study finds",55,258,0.95,independent.co.uk,0,0,False,theindependentonline,Health
1ggk46x,"Giving birth to triplets, quadruplets or even more has become increasingly less common in the United States",12,246,0.97,cnn.com,0,0,False,cnn,Health
1ggmpyd,RFK Jr. Wants to Reshape US Health Policy. Good Luck With That,48,153,0.87,wired.com,0,0,False,wiredmagazine,Health
1ggjncl,What alarms health experts most about RFK Jr. is what he’s leaving out of his health policy proposals,4,102,0.9,cnn.com,0,0,False,newzee1,Health
1ggdhbd,Nearly 6% of pregnant women report marijuana use,47,166,0.91,news.uga.edu,0,0,False,universityofga,Health
1ggm1bq,Limiting sugar in infancy reduces the risk of diabetes and hypertension | Children who experienced sugar rationing during WWII were less likely to develop chronic illnesses,2,44,0.96,sciencenews.org,0,0,False,Science_News,Health
1ggi25b,"On the topic of ""French press coffee is bad for you"" - coffee filtered with a metal filter will cause a minor increase in LDL",9,70,0.91,voltagecoffee.com,0,0,False,ryhaltswhiskey,Health
1ggakzs,Shortage of IV fluids leads to canceled surgeries,8,174,0.97,npr.org,0,0,False,Maxcactus,Health
1ggagml,Bird flu has been found in a pig for the first time in the U.S.,5,113,0.98,npr.org,0,0,False,Maxcactus,Health
1gfqc6t,A Texas Woman Died After the Hospital Said It Would be a “Crime” to Intervene in Her Miscarriage,102,1231,0.96,propublica.org,0,0,False,Exastiken,Health
1gfr61y,Throw Out Your Black Plastic Spatula,127,643,0.98,theatlantic.com,0,0,False,theatlantic,Health
1gg9bn7,Opinion | What We Lose When Pharmacists Are Forced to Act Like Cops (Gift Article),2,37,0.94,nytimes.com,0,0,False,nytopinion,Health
1gflh0q,RFK Jr. Says Trump Promised Him 'Control' Of CDC And Other Health Agencies,112,910,0.96,huffpost.com,0,0,False,asdtyyhfh,Health
1gga264,EU agency finds banned chemicals in some 6% of cosmetics – DW – 10/30/2024,3,19,0.93,dw.com,0,0,False,boppinmule,Health
1gfw154,CDC says slivered onions are likely cause of McDonald's E. coli infections as cases rise to 90,2,100,0.99,nbcnews.com,0,0,False,nbcnews,Health
1gft8m0,H5N1 bird flu detected in pig for the first time in the US,6,111,0.97,telegraph.co.uk,0,0,False,TheTelegraph,Health
1gfozhx,Quarter pounder leads to teen's kidney failure,23,186,0.94,ctvnews.ca,0,0,False,CTVNEWS,Health
1gfupvp,Why Dirt Is Good For Kids — And Could Lead To A Healthier Adulthood,11,81,0.96,inverse.com,0,0,False,mareacaspica,Health
1gfuj79,"Bird flu found in a pig in U.S. for the first time, raising concerns about potential risks to humans",5,78,0.95,statnews.com,0,0,False,statnews,Health
1ggk55d,"Your Questions About Open Enrollment, Answered",0,1,1.0,time.com,0,0,False,timemagazine,Health
1ggeibh,Mucus: It’s Snot What You Think,1,1,1.0,nytimes.com,0,0,False,spike,Health
1gfrn76,First case of dangerous new mpox strain confirmed in the UK,2,41,0.89,telegraph.co.uk,0,0,False,TheTelegraph,Health
1gfhuro,Bird flu outbreak: Map reveals confirmed US human cases,16,155,0.96,newsweek.com,0,0,False,newsweek,Health
1gfmh48,OpenAI’s Transcription Tool Hallucinates. Hospitals Are Using It Anyway,3,50,0.95,wired.com,0,0,False,wiredmagazine,Health
1gfor5k,"Tuberculosis returns as top infectious disease killer, WHO says",1,29,0.94,reuters.com,0,0,False,sasko12,Health
1gfmkak,Regular exercise may reduce death risks for new dementia patients,0,39,0.93,euronews.com,0,0,False,euronews-english,Health
1geycg6,"These nuts may help prevent blindness in old age, reveals scientist",32,274,0.92,newsweek.com,0,1,False,newsweek,Health
1ger75e,People opt out of organ donation programs after reports of a man mistakenly declared dead ,60,355,0.96,apnews.com,0,0,False,BobbyLucero,Health
1geuta0,Lung cancer on the rise in U.S. Asian women who don't smoke. Experts hope to expand screenings.,5,175,0.98,cbsnews.com,0,0,False,CBSnews,Health
1gey8dj,"Flu and COVID vaccination was way below target in 2023, ECDC says",1,47,0.98,euronews.com,0,0,False,euronews-english,Health
1geaaun,Donald Trump Vows to Let Robert F. Kennedy Jr. ‘Go Wild on Health’ If Elected,164,923,0.95,wired.com,0,1,False,wiredmagazine,Health
1geuacl,Exosomes are touted as a trendy cure-all. We don’t know if they work.,4,31,0.88,technologyreview.com,0,0,False,techreview,Health
1gexp44,Clinical Conundrum:  severe eczema flare or topical steroid withdrawal?,0,7,1.0,pulsetoday.co.uk,0,0,False,Sisu-cat-2004,Health
1ge4iyu,Why a group of Canadian doctors says workplace sick notes need to go,12,162,0.98,ctvnews.ca,0,0,False,CTVNEWS,Health
1gdwf6t,"""Serious lung infection"" linked to cruise ship hot tubs, CDC finds",40,570,0.98,newsweek.com,0,0,False,newsweek,Health
1gf0fzw,Poor Sleep In Your 40s Linked to Faster Brain Aging Later In Life,0,1,1.0,healthline.com,0,0,False,healthline,Health
1ge8qxy,Toxic Inaction: Oakland's lead funding languishes as residents live with serious health risks,0,30,0.87,eltimpano.org,0,0,False,jms1225,Health
1ge3od6,AI speeds up X-Ray diagnosis for broken bones,1,47,0.94,rollingout.com,0,0,False,BothZookeepergame612,Health
1gdrlye,Opinion | No One Tells You What Happens to Your Muscles in Your 40s (Gift Article),44,274,0.95,nytimes.com,0,0,False,nytopinion,Health
1gdj8eh,"Leading neurologists say evidence linking paraquat with Parkinson's disease is 'very strong', and they want it banned",79,742,0.99,abc.net.au,0,0,False,miolmok,Health
1gdx0u5,Daylight saving ends in Europe this weekend. Experts warn the time change could harm your health,2,8,1.0,euronews.com,0,0,False,euronews-english,Health
1gcwssd,Researchers say an AI-powered transcription tool used in hospitals invents things no one ever said,49,318,0.98,apnews.com,0,0,False,mcgillhufflepuff,Health
