id,title,num_comments,score,upvote_ratio,domain,gilded,num_crossposts,nsfw,author,subreddit
1gcn63d,"Hack at UnitedHealth's tech unit impacted 100 mln people, US health dept says",6,136,0.98,reuters.com,0,0,False,F0urLeafCl0ver,Health
1gcw04h,Are pumpkin seeds good for you? How to get a nutritional boost from your jack-o'-lantern.,1,32,0.95,usatoday.com,0,0,False,Specific-Ad7048,Health
1gckadg,Does activated charcoal interact with medication?,9,62,0.92,livescience.com,0,0,False,TylerFortier_Photo,Health
1gc4ggx,"Active ingredient in Ozempic, Wegovy may reduce risk of Alzheimer's disease: Study",40,487,0.96,abcnews.go.com,0,1,False,gordon22,Health
1gcgr55,Anti-malarial drug resistance is making malaria normal again,1,42,0.99,africanarguments.org,0,0,False,boppinmule,Health
1gc8q94,What food safety experts steer clear of to avoid E. coli,15,67,0.94,nbcnews.com,0,0,False,nbcnews,Health
1gbtbi5,One in 14 American Patients May Be Harmed by Hospital Diagnosis Mistakes,83,474,0.98,newsweek.com,0,0,False,chrisdh79,Health
1gbyva5,Fried foods contain advanced glycation end products that are involved in atherosclerosis and lead to premature aging,9,217,0.98,theguardian.com,0,1,False,smitra00,Health
1gbxauz,"McDonald's E. coli outbreak has sickened at least 75 people in 13 states, CDC says",31,191,0.98,cbsnews.com,0,0,False,CBSnews,Health
1gbtywn,Map reveals 20% Americans at risk of 'forever chemicals' in drinking water,26,230,0.97,newsweek.com,0,0,False,newsweek,Health
1gbvrni,"Teenagers are taking new weight-loss drugs, but the science is far from settled",43,137,0.98,scientificamerican.com,0,0,False,scientificamerican,Health
1gbymtv,McDonald’s E. coli updates: Number of states with outbreak grows to 13,3,57,0.98,nbcchicago.com,0,0,False,progress18,Health
1gbxe73,"Illnesses linked to McDonald's E. coli outbreak rise to 75, CDC says",0,32,1.0,nbcnews.com,0,0,False,nbcnews,Health
1gc0s97,Iron-(Fe3+)-Dependent Reactivation of Telomerase Drives Colorectal Cancers,4,16,0.92,pubmed.ncbi.nlm.nih.gov,0,0,False,Maxcactus,Health
1gbdnvr,Doctors Agreed Her Baby Would Die 3 Months Before She Was Forced to Give Birth,30,591,0.97,rollingstone.com,0,0,False,newzee1,Health
1gc21dl,DEA’s National Prescription Drug Take Back Day. On this webpage are resources to help you dispose of unneeded medications in your home ,0,3,0.81,dea.gov,0,0,False,jms1225,Health
1gbefyc,"McDonald's E.Coli outbreak leads Burger King, KFC, Pizza Hut to remove onions from some locations",8,143,0.97,cbsnews.com,0,0,False,CBSnews,Health
1gba7bv,Drinking is cheaper than it’s been in decades. Lobbyists are fighting to keep it that way,65,239,0.96,statnews.com,0,0,False,statnews,Health
1gbdvxm,This Essential Health Care Program Could Get Hammered If Donald Trump Wins,18,147,0.89,huffpost.com,0,0,False,newzee1,Health
1gb5xui,McDonald’s hit with lawsuit after deadly E. coli outbreak,14,252,0.98,globalnews.ca,0,0,False,globalnewsca,Health
1gbe036,Opinion | Abortion Pills Are Safe. Post-Roe America Isn’t. (Gift Article),2,64,0.91,nytimes.com,0,0,False,nytopinion,Health
1gb4h8q,FDA eyes McDonald's supplier Taylor Farms as source of E. Coli outbreak,17,188,0.98,nbcnews.com,0,0,False,nbcnews,Health
1gbc37c,This radioactive gas is a leading cause of lung cancer. Here's how to check if it's in your home,21,63,0.82,ctvnews.ca,0,0,False,CTVNEWS,Health
1gb7z37,McDonald's pulls Quarter Pounders from one-fifth of U.S. stores after E. coli outbreak,8,56,0.95,cbc.ca,0,0,False,progress18,Health
1gb1aim,Human space travel could pose more severe health risks finds new report,1,49,0.93,spacedaily.com,0,0,False,solid_boss55,Health
1gb8w9x,Human bird flu cases in California may be undercounted as workers resist testing,0,16,0.87,reuters.com,0,1,False,Randomlynumbered,Health
1gb254n,Inside the Company Helping America’s Biggest Health Insurers Deny Coverage for Treatments,5,24,0.92,propublica.org,0,0,False,rytis,Health
1gaopud,McDonald's zeroes in on onions as the likely source of deadly E. coli outbreak,35,293,0.97,nbcnews.com,0,2,False,nbcnews,Health
1gav1jb,"People 50 and older should get pneumococcal vaccine, U.S. health officials recommend",19,84,0.92,apnews.com,0,0,False,duderos,Health
1gb3byx,How to spot early signs of potentially fatal whooping cough as cases rise,0,13,0.94,newsweek.com,0,1,False,newsweek,Health
1gak88b,"More couples are engaging in viral ‘sleep divorce’ trend on vacation, study finds",65,312,0.92,independent.co.uk,0,0,False,theindependentonline,Health
1gaxrke,Research shows coffee could increase cholesterol levels in blood,13,33,0.79,getsurrey.co.uk,0,1,False,SubstantialSnow7114,Health
1gb508x,Why Do People Sleepwalk?,6,8,0.83,time.com,0,0,False,timemagazine,Health
1gac5xe,The Maker of Ozempic Is Trying to Block Compounded Versions of Its Blockbuster Drug,82,460,0.97,wired.com,0,0,False,wiredmagazine,Health
1gb4wpw,New AI tool that can predict death to be trialled on heart patients,2,5,0.86,euronews.com,0,0,False,euronews-english,Health
1gaxrkn,"New Alzheimer’s drug approved in UK, but government won’t pay for it",10,12,0.94,euronews.com,0,0,False,euronews-english,Health
1gaim2e,CDC told McDonald's about potential E. coli outbreak late last week,5,139,0.97,cnbc.com,0,0,False,cnbc_official,Health
1gaibqv,“Not Medically Necessary”: Inside the Company Helping America’s Biggest Health Insurers Deny Coverage for Care,3,77,0.95,propublica.org,0,0,False,zsreport,Health
1gaeawv,Early research suggested long COVID didn't affect children. New studies say that's not true,2,98,0.98,ksl.com,0,0,False,ajb160,Health
1gaforz,Study busts myths about cause of gout,11,76,0.96,otago.ac.nz,0,1,False,F0urLeafCl0ver,Health
1ga3er6,"Your Morning Coffee Could Be Quietly Causing Hearing Loss, Study Reveals",139,313,0.85,headphonesty.com,0,2,False,ChocoMuchacho,Health
1gacud3,High Levels of Banned PFAS Detected in Hershey’s Packaging | Independent Tests Reveal Widespread Presence of Cancer-Linked “Forever Chemicals” in its Biggest Brands,3,51,0.96,grizzlyreports.com,0,0,False,chrisdh79,Health
1ga956k,Egypt has been declared malaria-free by the World Health Organization,0,77,0.99,npr.org,0,0,False,Maxcactus,Health
1ga9r9w,"FDA says this weight loss drug shortage is over, but patients worry about cost and availability",5,34,0.95,cbsnews.com,0,0,False,CBSnews,Health
1ga4o7i,"Man who had scurvy describes symptoms: ""I first noticed the weakness""",34,91,0.92,newsweek.com,0,0,False,newsweek,Health
1g9sjy8,E. coli outbreak linked to McDonald’s Quarter Pounders in multiple states,53,544,0.98,nbcnews.com,0,0,False,nbcnews,Health
1ga75ca,UK testing ‘world-first’ vaccine for vomiting bug norovirus,15,46,0.95,euronews.com,0,0,False,euronews-english,Health
1g9u1ad,"Air pollution could be causing kids to develop peanut allergies, new study reveals",5,131,0.99,independent.co.uk,0,0,False,theindependentonline,Health
1g9m42n,Why so many listeria recalls lately? A doctor explains what to know and symptoms to look for.,28,202,0.99,cbsnews.com,0,0,False,CBSnews,Health
1g9le3b,"Anosmia, the inability to smell, changes how people breathe",9,149,0.99,scientificamerican.com,0,0,False,scientificamerican,Health
1g9p7vk,Some Juul users are receiving thousands of dollars as part of a $300 million class action settlement,5,63,0.96,nbcnews.com,0,0,False,nbcnews,Health
1gaf870,Does the updated COVID-19 vaccine protect against the XEC variant?,4,2,0.57,ctvnews.ca,0,0,False,CTVNEWS,Health
1g9iq4d,"Bird flu suspected in four Washington farm workers, CDC sends team",7,96,0.99,nbcnews.com,0,0,False,Maxcactus,Health
1g9k755,"Melatonin disruption tied to early-onset osteoporosis, new study suggests",5,49,0.96,livescience.com,0,0,False,BothZookeepergame612,Health
1g9ieno,Germany detects first case of dangerous new mpox strain,4,64,0.91,telegraph.co.uk,0,0,False,TheTelegraph,Health
1g9z1gc,What is topical steroid withdrawal syndrome - the skin condition taking Tik Tok by storm ,0,4,0.63,womenshealthmag.com,0,0,False,Sisu-cat-2004,Health
1g9kkt6,Frozen waffle recall: What to know as CFIA expands on listeria warning,1,38,0.91,globalnews.ca,0,0,False,globalnewsca,Health
1g8zgwd,Sugar tax on beverages reduces consumption in low income households by nearly 50%,44,580,0.98,washington.edu,0,1,False,mareacaspica,Health
1g9tube,Germany detects first mpox variant Ib case,1,6,0.75,dw.com,0,0,False,maki23,Health
1g9knqa,New treatment can help those with OCD,1,15,0.82,ctvnews.ca,0,0,False,CTVNEWS,Health
1g9b29k,Opinion | It’s Always Virus Season Now (Gift Article),2,82,0.95,nytimes.com,0,1,False,nytopinion,Health
1g9cvjl,Egypt declared malaria-free after 100-year effort,0,46,0.95,bbc.com,0,0,False,F0urLeafCl0ver,Health
1g8wkqv,12 Symptoms Endocrinologists Say You Should Never Ignore,58,291,0.95,time.com,0,1,False,timemagazine,Health
1g91rti,Flesh-eating bacteria cases rise in Florida following recent hurricanes,2,100,0.98,cbsnews.com,0,0,False,CBSnews,Health
1g8pwkd,"Insurance should pay for over-the-counter birth control, White House proposes",9,453,0.98,nbcnews.com,0,0,False,nbcnews,Health
1g9adif,How can we slow down diabetes-related brain aging?,1,22,0.91,medicalnewstoday.com,0,0,False,ChocoMuchacho,Health
1g8xn14,Multimillionaire biohacker replaces the ‘liquid gold’ in his body in bid to reverse aging,89,142,0.84,independent.co.uk,0,0,False,cuspofgreatness,Health
1g90gl9,The Perverse Consequences of Tuition-Free Medical School,25,90,0.84,theatlantic.com,0,0,False,theatlantic,Health
1g8wsa3,University of Missouri-Kansas City Study Finds Colorectal Cancer Cases Up 500% among Children,15,133,0.99,darkdaily.com,0,1,False,IndependenceAny8863,Health
1g9bw98,"Inside the Bungled Bird Flu Response, Where Profits Collide With Public Health",1,14,0.89,vanityfair.com,0,0,False,newzee1,Health
1g9frgg,How to Close the Gender Health Gap,2,3,0.57,wired.com,0,0,False,wiredmagazine,Health
1g9px58,Can AI shake up translational research?,0,1,0.67,nature.com,0,0,False,cartmanbeck,Health
1g8sm3c,US takeover of prized French painkiller to go ahead,10,86,0.86,lemonde.fr,0,0,False,LeMonde_en,Health
1g8q680,Roche’s big bet on big diseases,2,44,0.95,swissinfo.ch,0,0,False,Realistic-Lie-8031,Health
1g8v871,GE HealthCare announces time-saving AI tool for doctors who treat cancer,2,20,0.9,cnbc.com,0,0,False,cnbc_official,Health
1g8mhl1,Rwanda reports no new Marburg infections or deaths for nearly a week,0,40,0.92,euronews.com,0,0,False,euronews-english,Health
1g9ife1,5 Gastroenterologists on the 1 Thing You Should Do Every Day,10,0,0.39,time.com,0,0,False,timemagazine,Health
1g8fpux,"The Daily Galaxy --Great Discoveries Channel: Study finds common sleeping pill may reduce Alzheimer's protein buildup, ScienceAlert reports",6,114,0.98,dailygalaxy.com,0,1,False,BothZookeepergame612,Health
1g8hgc5,Opinion | The Breakthrough Drug to Conquer Addiction: Ozempic? (Gift Article),2,40,0.85,nytimes.com,0,0,False,nytopinion,Health
1g8hlyw,Opinion | This Is What It Takes to Get an Abortion in America (Gift Article),2,33,0.88,nytimes.com,0,0,False,nytopinion,Health
1g8c1r5,Climate change and health – what’s the connection?,2,29,0.87,amnesty.org,0,0,False,crustose_lichen,Health
1g7tldc,"Serious infections linked to dementia risk, study shows",2,155,0.99,msn.com,0,1,False,F0urLeafCl0ver,Health
1g7vvx6,Hopeful that a human trial will help spinal cord injury patients,2,77,0.99,abc.net.au,0,0,False,miolmok,Health
1g76nhf,"Ozempic shows promise for treating alcohol and drug abuse, study finds",24,448,0.97,npr.org,0,0,False,Maxcactus,Health
1g7hkwu,Big tobacco companies reach tentative multibillion-dollar settlement with Canada,3,58,0.95,abcnews.go.com,0,0,False,boppinmule,Health
1g7c2dc,"A man declared dead almost had surgery to donate his organs, but he was still alive : Shots - Health News : NPR",20,121,0.89,npr.org,0,0,False,Joke-Fast,Health
1g6v9sj,Routine dental X-rays are not backed by evidence—experts want it to stop,64,537,0.96,arstechnica.com,0,0,False,F0urLeafCl0ver,Health
1g6q5pr,Companies Knew the Dangers of PFAS 'Forever Chemicals'—and Kept Them Secret,34,786,0.99,time.com,0,0,False,Hazzman,Health
1g6qzdn,Drug overdose deaths fall for 6 months straight as officials wonder what's working,67,430,0.98,nbcnews.com,0,0,False,nbcnews,Health
1g6tw1t,How does the brain react to birth control? A researcher scanned herself 75 times to find out. Extensive scans reveal rhythmic changes in the brain throughout the menstrual cycle and while on the pill.,15,174,0.98,nature.com,0,0,False,maxkozlov,Health
1g6pl9j,"Millennials, could it be perimenopause? Managing the overlooked life stage",6,143,0.97,globalnews.ca,0,0,False,globalnewsca,Health
1g6gnn3,'Forever Chemicals' Linked to Poorer Sleep,2,166,0.98,e360.yale.edu,0,1,False,YaleE360,Health
1g6lig3,U.S. boosts passenger screening as Africa grapples with deadly Marburg and mpox outbreaks,2,59,0.96,cbsnews.com,0,0,False,CBSnews,Health
1g6hk42,"Tobacco giants would pay out $32.5 billion to provinces, smokers in proposed deal",8,93,0.99,ctvnews.ca,0,0,False,CTVNEWS,Health
1g6j72w,"Whooping cough cases surge in US, Europe post-COVID pandemic",1,42,0.96,euronews.com,0,0,False,euronews-english,Health
1g6hj80,"If your Apple Watch alerts you to sleep apnea, here's what it means and what to do next",3,24,0.92,ctvnews.ca,0,0,False,CTVNEWS,Health
1g5wkju,Sales of baby food pouches have increased by 900 percent. Experts think that’s a problem,51,419,0.97,independent.co.uk,0,0,False,theindependentonline,Health
1g685zg,Coca-Cola recalled thousands of cases of lemonade mislabeled as ‘zero sugar’,2,67,0.96,cnn.com,0,0,False,cnn,Health
1g5zr8t,"‘Horrifying’ mistake to take organs from a living person averted, witnesses say",17,183,0.94,npr.org,0,0,False,little_german,Health
1g5xgg7,"USC study finds link between PFAS, kidney function and gut health",3,84,1.0,keck.usc.edu,0,0,False,mcgillhufflepuff,Health
1g5nbmr,"Alzheimer's: Hidden ""early"" brain damage phase revealed by neuroscientists",19,334,0.98,newsweek.com,0,1,False,newsweek,Health
1g5uixt,"In children, Covid is tied to higher risk of type 2 diabetes",7,94,0.98,statnews.com,0,0,False,statnews,Health
1g5z4rz,"Weight loss drugs could help with alcohol and opioid addiction, new study shows",1,47,0.93,cbsnews.com,0,0,False,CBSnews,Health
1g5mydf,CVS and Walgreens are ailing. Here’s why,66,235,0.95,npr.org,0,0,False,Maxcactus,Health
1g5m7qo,UK doctors to government: ‘Make the tobacco industry pay’,0,39,0.95,euronews.com,0,0,False,euronews-english,Health
1g55yfr,"Standing desks may be bad for your health, study suggests",61,271,0.92,theguardian.com,0,0,False,DreamingDemon,Health
1g6erhd,"Doctor has warning over diet drinks, especially for women",22,0,0.38,getsurrey.co.uk,0,0,False,SubstantialSnow7114,Health
1g58lht,"6 confirmed cases of Bird flu in California, public health and dairies aim to protect employees",4,84,0.95,abc30.com,0,0,False,progress18,Health
1g4z2w8,Oat milk: Why wellness influencers have stopped drinking it,124,272,0.81,newsweek.com,0,0,False,newsweek,Health
1g59tzy,Nevada boy able to sleep with his eyes closed for the first time,1,53,0.92,ctvnews.ca,0,0,False,CTVNEWS,Health
1g4yyzz,"15.5 million US adults now have ADHD, but system continues to fail most",15,170,0.96,cdc.gov,0,0,False,chrisdh79,Health
1g56kh7,Novavax says FDA put hold on combination Covid-flu shot and influenza vaccine; shares plunge,2,42,0.94,cnbc.com,0,0,False,cnbc_official,Health
1g549b1,GLP-1 Is Going the Way of Gut Health,1,57,0.92,theatlantic.com,0,0,False,theatlantic,Health
1g5660u,Your diet can change your immune system — here’s how,5,35,0.86,nature.com,0,0,False,BothZookeepergame612,Health
1g4xpkh,Coffee in pregnancy advice update after new mass study,15,94,0.95,getsurrey.co.uk,0,1,False,SubstantialSnow7114,Health
1g4lqcv,Nearly 10 million pounds of ready-to-eat chicken products recalled over listeria risk,43,309,0.99,nbcnews.com,0,0,False,nbcnews,Health
1g4hiap,"As IV shortage continues after hurricane, U.S. invokes wartime power to speed recovery",20,449,0.99,cbsnews.com,0,0,False,CBSnews,Health
1g4ts8i,US schoolchildren having seizures from over-the-counter drugs,4,60,0.85,newsweek.com,0,0,False,newsweek,Health
1g48lmh,New nasal vaccines offer better protection from COVID and flu—no needle needed,13,305,0.98,scientificamerican.com,0,0,False,scientificamerican,Health
1g4yp5l,Is it time to freak out about bird flu?,3,5,0.73,statnews.com,0,0,False,statnews,Health
1g4iq6x,USDA investigating its handling of Boar’s Head listeria outbreak,1,70,0.97,nbcconnecticut.com,0,0,False,nbcnews,Health
1g4b2ix,N.S. woman resorts to surgery in U.S. for endometriosis due to Canadian wait times,59,161,0.86,globalnews.ca,0,0,False,globalnewsca,Health
1g42i64,New cervical cancer treatment cuts death risk by 40%,3,173,1.0,getsurrey.co.uk,0,0,False,SubstantialSnow7114,Health
1g4e6ff,The country with lowest fertility rate gives medals to two women who had 13 children each | The Independent ,3,24,0.74,msn.com,0,0,False,Nscience,Health
1g3p9nm,Six-Week Abortion Bans: More Than a Third of Women Don't Know They Are Pregnant by 6 Weeks,38,757,0.98,healthday.com,0,0,False,Exastiken,Health
1g3umt8,"130,000 U.S. cancer cases went undiagnosed in Covid pandemic, study finds",10,223,0.98,statnews.com,0,0,False,statnews,Health
1g4ghg2,Everything you need to know about the 'Ozempic for drinkers',1,3,0.67,msn.com,0,0,False,TylerFortier_Photo,Health
1g3o4uf,Families sacrifice time and money caring for loved ones. A new caregiver calculator reveals the high cost.,5,179,1.0,cbsnews.com,0,1,False,CBSnews,Health
1g3b0lz,"Gynecologist reveals Ozempic's ""unexpected"" effects on your vagina",49,526,0.95,newsweek.com,0,2,False,newsweek,Health
1g3aufo,"ADHD suspected by 1 in 4 American adults, survey finds",110,444,0.97,newsweek.com,0,1,False,newsweek,Health
1g3lkgc,Health-care costs hit a post-pandemic high. These moves during open enrollment can help,4,46,0.93,cnbc.com,0,0,False,cnbc_official,Health
1g3q4aj,Opinion | I Froze My Eggs to Reclaim My Right to Rest (Gift Article),1,24,0.84,nytimes.com,0,0,False,nytopinion,Health
1g34ny8,Thousands of toxins from food packaging found in humans – research ,31,460,0.99,theguardian.com,0,1,False,happy_bluebird,Health
1g2s1q8,Dense breasts can make it harder to spot cancer on a mammogram,55,268,0.97,wcvb.com,0,0,False,KingSash,Health
1g2q3qv,Eating less can lead to a longer life: study in mice shows why,48,249,0.98,nature.com,0,0,False,BothZookeepergame612,Health
1g2q9f7,13 Essential Foods That Will Safeguard Your Kidney Health,12,107,0.94,cnet.com,0,0,False,newzee1,Health
1g2o3uk,Why everything you think about living to 100 might be wrong,35,135,0.94,theguardian.com,0,0,False,F0urLeafCl0ver,Health
1g2n8zq,"New rules should make methadone easier to get, but change is slow in many places",2,56,0.99,npr.org,0,0,False,Maxcactus,Health
1g24o0x,Over 86% of surveyed health care providers are short on IV fluids | Providers are starting to put off elective surgeries and other procedures.,10,304,0.99,arstechnica.com,0,1,False,chrisdh79,Health
1g29xpw,Rwanda Marburg outbreak: Africa health chief criticises US travel advice,0,47,0.96,bbc.com,0,0,False,sasht,Health
1g1do4t,Six possible human infections as H5N1 breaks into Californian dairy heartlands,23,297,0.97,telegraph.co.uk,0,1,False,TheTelegraph,Health
1g1ls4p,Missing immune cells may explain why COVID-19 vaccine protection quickly wanes,1,69,0.93,science.org,0,0,False,konkhra,Health
1g18uoi,France to patients: Take weight loss drug Wegovy on your own dime,85,402,0.98,euronews.com,0,0,False,euronews-english,Health
1g1ftoc,Patients scramble for treatments as hospitals conserve IV fluids after storms,7,139,0.99,nbcnews.com,0,0,False,nbcnews,Health
1g16rit,Worst U.S. whooping cough outbreak in a decade has infected thousands,49,535,0.99,npr.org,0,1,False,Maxcactus,Health
1g1inzd,Obesity-related deaths on the rise in US—but there is good news for cardiologists,1,47,0.93,cardiovascularbusiness.com,0,0,False,nrverma,Health
1g1blpy,"Common heart conditions raise the risk of dementia, experts say",1,65,0.96,ctvnews.ca,0,0,False,CTVNEWS,Health
1g11kxt,"'There's nobody like him': Sammy Basso, longest survivor of rapid ageing disease, dies at 28",8,360,0.99,cbc.ca,0,0,False,newzee1,Health
1g1hfdl,"As Eli Lilly, compounders battle over weight loss drugs, patients are caught in the middle",0,22,0.89,statnews.com,0,0,False,statnews,Health
1g0s7x0,Nearly 10 million pounds of meat recalled due to listeria concerns,49,439,0.98,cnn.com,0,1,False,cnn,Health
1g1dwym,Quantum Woo’s Irresistible Energy,3,8,0.9,theatlantic.com,0,0,False,theatlantic,Health
1g18u3t,Marburg in Rwanda: What to Expect | Think Global Health,0,8,0.84,thinkglobalhealth.org,0,0,False,Nscience,Health
1g0rtvm,"Breast cancer vaccine shows promising results: Q&A With Dr. Matthew Kurian, Hematologist/Oncologist - LINK nky",3,64,1.0,linknky.com,0,0,False,TylerFortier_Photo,Health
1g0lji0,Vaccines could put a major dent in deaths from antibiotic resistance,3,127,0.98,euronews.com,0,0,False,euronews-english,Health
1g0hent,Large cohort study shows increased risk of developing atopic dermatitis after COVID‐19 disease,20,168,1.0,onlinelibrary.wiley.com,0,0,False,AsAboveSoBelow322,Health
1g20loz,I’m a doctor — here’s why you should never pee in the shower,22,0,0.19,yahoo.com,0,0,False,TylerFortier_Photo,Health
1g0ttxz,UK firm GSK to pay $2.2bn over Zantac cancer claims,1,20,0.92,bbc.com,0,0,False,cuspofgreatness,Health
1g0luv0,Microsoft announces new AI tools to help ease workload for doctors and nurses,5,49,0.86,cnbc.com,0,0,False,cnbc_official,Health
1g0e3ng,Best and worst states for building healthy lifestyle revealed,22,88,0.92,newsweek.com,0,2,False,newsweek,Health
1g0kjjp,Opinion | TV Medical Dramas Are Not Like Real Life. Maybe They Should Be. (Gift Article),5,23,0.96,nytimes.com,0,0,False,nytopinion,Health
1g0jecv,It is World Mental Health Day - What are you doing during these wild times to protect your mental wellbeing? ,4,11,0.83,who.int,0,0,False,UncoveringScandals90,Health
1g0lh32,"Using math and machine learning, researchers predict early flu spike in Canada, U.S. | University of Alberta professor says the data could help public health officials prepare",2,9,0.92,cbc.ca,0,0,False,Hrmbee,Health
1g0ddur,Coffee for Your Heart: The Regenerative Power of Caffeine on Vascular Health,4,29,0.92,scitechdaily.com,0,0,False,ThrillSurgeon,Health
1fzq7ke,"Covid-19 may increase the risk of heart attacks, strokes and deaths for three years after an infection, study suggests",54,723,0.97,cnn.com,0,0,False,ajb160,Health
1fztqcc,Helene caused a national IV fluid shortage. Milton could make it worse. | The latest hurricane could hit a Daytona Beach facility that provides nearly a quarter of the nation’s intravenous fluid supply.,12,331,0.99,eenews.net,0,0,False,harsh2k5,Health
1fzykqc,Amazon same-day prescription delivery expanding to nearly half of U.S. in 2025,4,60,0.91,cnbc.com,0,0,False,cnbc_official,Health
1fzr8mr,Ozempic underworld: Inside the black market of obesity drugs,32,119,0.95,cnbc.com,0,0,False,cnbc_official,Health
1fzprhv,Your Brain Changes Based on What You Did Two Weeks Ago | A workout or restless night from two weeks ago could still be affecting you—positively or negatively—today.,4,130,0.96,newsweek.com,0,0,False,chrisdh79,Health
1fzr06j,Florida Hospitals and Nursing Homes Are Bracing for Hurricane Milton,3,24,0.92,wired.com,0,0,False,wiredmagazine,Health
1fzupm6,Opinion | The Complicated Legacy of Betty Ford’s Breast Cancer Story (Gift Article),2,16,0.88,nytimes.com,0,0,False,nytopinion,Health
1fzu81r,Tons of Viruses Live in Your Toothbrush and Showerhead,6,13,0.81,time.com,0,0,False,timemagazine,Health
1fz65yp,Study shows Texas’ abortion ban is straining the OB/GYN pool,39,645,0.97,texastribune.org,0,0,False,DoremusJessup,Health
1fzx32a,A CNBC investigation into counterfeit weight loss drugs revealed an international illegal marketplace where criminals either alter the drugs or ship the real product from overseas — what’s known as drug diversion and against federal law.,1,8,1.0,nbcnews.com,0,1,False,nbcnews,Health
1g0arxk,Implausibility of radical life extension in humans in the twenty-first century,0,1,0.67,nature.com,0,0,False,Nautil_us,Health
1fzt985,"Report suggests decrease in condom use among Canadian youth, lack of safe-sex education",0,9,0.81,ctvnews.ca,0,0,False,CTVNEWS,Health
1fzmdl2,New cancer drug launches leave low-income countries behind - study,4,36,0.87,euronews.com,0,0,False,euronews-english,Health
1fzjcc9,Nature.com: World-first therapy using donor cells sends autoimmune diseases into remission,1,66,0.95,nature.com,0,0,False,BothZookeepergame612,Health
1fyyoda,Millennial applauded for sharing reality of depression in your 20s,44,244,0.88,newsweek.com,0,0,False,newsweek,Health
1fz369k,Supreme Court Decides to Let Texas Women Die,9,126,0.92,newrepublic.com,0,0,False,newzee1,Health
1fz8zwt,Posts encouraging eating disorders were recommended to X users,5,54,0.94,nbcnews.com,0,0,False,mcgillhufflepuff,Health
1fz0tkm,Map reveals US states where healthcare is least accessible,33,150,0.98,newsweek.com,0,1,False,newsweek,Health
1fz8gpa,How Rwanda is containing a deadly Marburg virus outbreak,2,33,0.95,scientificamerican.com,0,0,False,scientificamerican,Health
1fyy8p5,Canadian doctors warned to be on the lookout for scurvy,19,100,0.98,cbc.ca,0,0,False,Sisu-cat-2004,Health
1fz13xt,"Fourteen AGs sue TikTok, accusing it of harming children’s mental health",6,43,0.95,nbcnews.com,0,0,False,nbcnews,Health
1fyoerd,"Advances in extending the human lifespan have slowed in recent decades, leaving it unlikely many of today’s children will live to 100, a new analysis finds",20,194,0.96,cnn.com,0,0,False,cnn,Health
1fybfc4,Alcohol Plays a Major Role in New Cancer Cases,159,957,0.97,wired.com,0,1,False,wiredmagazine,Health
