id,title,num_comments,score,upvote_ratio,domain,num_crossposts,nsfw,author,subreddit,date
1ga956k,Egypt has been declared malaria-free by the World Health Organization,0,80,1.0,npr.org,0,False,Maxcactus,Health,2024-10-23
1ga9r9w,"FDA says this weight loss drug shortage is over, but patients worry about cost and availability",5,36,0.95,cbsnews.com,0,False,CBSnews,Health,2024-10-23
1ga4o7i,"Man who had scurvy describes symptoms: ""I first noticed the weakness""",34,89,0.92,newsweek.com,0,False,newsweek,Health,2024-10-23
1g9sjy8,E. coli outbreak linked to McDonald’s Quarter Pounders in multiple states,53,537,0.98,nbcnews.com,0,False,nbcnews,Health,2024-10-22
1ga75ca,UK testing ‘world-first’ vaccine for vomiting bug norovirus,15,43,0.94,euronews.com,0,False,euronews-english,Health,2024-10-23
1g9u1ad,"Air pollution could be causing kids to develop peanut allergies, new study reveals",5,130,0.99,independent.co.uk,0,False,theindependentonline,Health,2024-10-22
1g9m42n,Why so many listeria recalls lately? A doctor explains what to know and symptoms to look for.,28,201,0.99,cbsnews.com,0,False,CBSnews,Health,2024-10-22
1g9le3b,"Anosmia, the inability to smell, changes how people breathe",9,146,0.99,scientificamerican.com,0,False,scientificamerican,Health,2024-10-22
1g9p7vk,Some Juul users are receiving thousands of dollars as part of a $300 million class action settlement,5,60,0.95,nbcnews.com,0,False,nbcnews,Health,2024-10-22
1gaf870,Does the updated COVID-19 vaccine protect against the XEC variant?,4,3,0.6,ctvnews.ca,0,False,CTVNEWS,Health,2024-10-23
1g9iq4d,"Bird flu suspected in four Washington farm workers, CDC sends team",7,95,0.99,nbcnews.com,0,False,Maxcactus,Health,2024-10-22
1g9k755,"Melatonin disruption tied to early-onset osteoporosis, new study suggests",5,54,0.98,livescience.com,0,False,BothZookeepergame612,Health,2024-10-22
1g9ieno,Germany detects first case of dangerous new mpox strain,4,64,0.91,telegraph.co.uk,0,False,TheTelegraph,Health,2024-10-22
1g9z1gc,What is topical steroid withdrawal syndrome - the skin condition taking Tik Tok by storm ,0,8,0.75,womenshealthmag.com,0,False,Sisu-cat-2004,Health,2024-10-23
1g9kkt6,Frozen waffle recall: What to know as CFIA expands on listeria warning,1,42,0.93,globalnews.ca,0,False,globalnewsca,Health,2024-10-22
1g8zgwd,Sugar tax on beverages reduces consumption in low income households by nearly 50%,44,576,0.98,washington.edu,1,False,mareacaspica,Health,2024-10-21
1g9tube,Germany detects first mpox variant Ib case,1,5,0.73,dw.com,0,False,maki23,Health,2024-10-22
1g9knqa,New treatment can help those with OCD,1,15,0.84,ctvnews.ca,0,False,CTVNEWS,Health,2024-10-22
1g9b29k,Opinion | It’s Always Virus Season Now (Gift Article),2,80,0.95,nytimes.com,1,False,nytopinion,Health,2024-10-22
1g9cvjl,Egypt declared malaria-free after 100-year effort,0,44,0.95,bbc.com,0,False,F0urLeafCl0ver,Health,2024-10-22
1g8wkqv,12 Symptoms Endocrinologists Say You Should Never Ignore,59,292,0.95,time.com,1,False,timemagazine,Health,2024-10-21
1g91rti,Flesh-eating bacteria cases rise in Florida following recent hurricanes,2,104,0.98,cbsnews.com,0,False,CBSnews,Health,2024-10-21
1g8pwkd,"Insurance should pay for over-the-counter birth control, White House proposes",9,457,0.98,nbcnews.com,0,False,nbcnews,Health,2024-10-21
1g9adif,How can we slow down diabetes-related brain aging?,1,24,0.92,medicalnewstoday.com,0,False,ChocoMuchacho,Health,2024-10-22
1g8xn14,Multimillionaire biohacker replaces the ‘liquid gold’ in his body in bid to reverse aging,88,145,0.84,independent.co.uk,0,False,cuspofgreatness,Health,2024-10-21
1g90gl9,The Perverse Consequences of Tuition-Free Medical School,26,89,0.84,theatlantic.com,0,False,theatlantic,Health,2024-10-21
1g8wsa3,University of Missouri-Kansas City Study Finds Colorectal Cancer Cases Up 500% among Children,15,131,0.99,darkdaily.com,1,False,IndependenceAny8863,Health,2024-10-21
1g9bw98,"Inside the Bungled Bird Flu Response, Where Profits Collide With Public Health",1,14,0.89,vanityfair.com,0,False,newzee1,Health,2024-10-22
1g9frgg,How to Close the Gender Health Gap,2,3,0.57,wired.com,0,False,wiredmagazine,Health,2024-10-22
1g9px58,Can AI shake up translational research?,0,1,0.67,nature.com,0,False,cartmanbeck,Health,2024-10-22
1g8sm3c,US takeover of prized French painkiller to go ahead,10,85,0.86,lemonde.fr,0,False,LeMonde_en,Health,2024-10-21
1g8q680,Roche’s big bet on big diseases,2,42,0.93,swissinfo.ch,0,False,Realistic-Lie-8031,Health,2024-10-21
1g8v871,GE HealthCare announces time-saving AI tool for doctors who treat cancer,2,20,0.88,cnbc.com,0,False,cnbc_official,Health,2024-10-21
1g8mhl1,Rwanda reports no new Marburg infections or deaths for nearly a week,0,43,0.93,euronews.com,0,False,euronews-english,Health,2024-10-21
1g9ife1,5 Gastroenterologists on the 1 Thing You Should Do Every Day,10,0,0.42,time.com,0,False,timemagazine,Health,2024-10-22
1g8fpux,"The Daily Galaxy --Great Discoveries Channel: Study finds common sleeping pill may reduce Alzheimer's protein buildup, ScienceAlert reports",6,116,0.98,dailygalaxy.com,1,False,BothZookeepergame612,Health,2024-10-21
1g8hgc5,Opinion | The Breakthrough Drug to Conquer Addiction: Ozempic? (Gift Article),2,45,0.89,nytimes.com,0,False,nytopinion,Health,2024-10-21
1g8hlyw,Opinion | This Is What It Takes to Get an Abortion in America (Gift Article),2,36,0.89,nytimes.com,0,False,nytopinion,Health,2024-10-21
1g8c1r5,Climate change and health – what’s the connection?,2,29,0.87,amnesty.org,0,False,crustose_lichen,Health,2024-10-20
1g7tldc,"Serious infections linked to dementia risk, study shows",2,155,0.99,msn.com,1,False,F0urLeafCl0ver,Health,2024-10-20
1g7vvx6,Hopeful that a human trial will help spinal cord injury patients,2,75,0.98,abc.net.au,0,False,miolmok,Health,2024-10-20
1g76nhf,"Ozempic shows promise for treating alcohol and drug abuse, study finds",24,450,0.97,npr.org,0,False,Maxcactus,Health,2024-10-19
1g7hkwu,Big tobacco companies reach tentative multibillion-dollar settlement with Canada,3,57,0.95,abcnews.go.com,0,False,boppinmule,Health,2024-10-19
1g7c2dc,"A man declared dead almost had surgery to donate his organs, but he was still alive : Shots - Health News : NPR",20,119,0.89,npr.org,0,False,Joke-Fast,Health,2024-10-19
1g6v9sj,Routine dental X-rays are not backed by evidence—experts want it to stop,64,534,0.96,arstechnica.com,0,False,F0urLeafCl0ver,Health,2024-10-18
1g6q5pr,Companies Knew the Dangers of PFAS 'Forever Chemicals'—and Kept Them Secret,34,794,0.99,time.com,0,False,Hazzman,Health,2024-10-18
1g6qzdn,Drug overdose deaths fall for 6 months straight as officials wonder what's working,67,425,0.98,nbcnews.com,0,False,nbcnews,Health,2024-10-18
1g6tw1t,How does the brain react to birth control? A researcher scanned herself 75 times to find out. Extensive scans reveal rhythmic changes in the brain throughout the menstrual cycle and while on the pill.,15,174,0.98,nature.com,0,False,maxkozlov,Health,2024-10-18
1g6pl9j,"Millennials, could it be perimenopause? Managing the overlooked life stage",6,143,0.97,globalnews.ca,0,False,globalnewsca,Health,2024-10-18
