id,title,num_comments,score,upvote_ratio,domain,num_crossposts,nsfw,author,subreddit,date
1go2ce3,"The WHO called antimicrobial resistance “an increasingly serious threat to global public health that requires action across all government sectors and society."" Growing evidence suggests antibiotic resistance is largely caused by antibiotic use in animal agriculture. Veganism is a solution.",99,279,0.88,pmc.ncbi.nlm.nih.gov,0,False,H0w-1nt3r3st1ng,Health,2024-11-10
1gpcp82,Opinion | Wellness Should be Just a Hobby (Gift Article),3,0,0.38,nytimes.com,0,False,nytopinion,Health,2024-11-12
1gny59u,Virulent New “Super-Strain” of Bacteria Is Rapidly Spreading in Asia,91,413,0.97,scitechdaily.com,1,False,Maxcactus,Health,2024-11-10
1gowilu,UK scientists testing chemical in red grapes to prevent bowel cancer,0,1,1.0,euronews.com,0,False,euronews-english,Health,2024-11-11
1got0k6,"Ultra-processed foods may accelerate biological ageing, study finds",0,1,1.0,euronews.com,0,False,euronews-english,Health,2024-11-11
1gnrm7o,"Weight loss drug Ozempic can affect muscle mass, study shows",82,197,0.93,thehill.com,0,False,DoremusJessup,Health,2024-11-10
1gnqb47,HPV vaccination: How the world can eliminate cervical cancer,5,109,0.95,ourworldindata.org,0,False,F0urLeafCl0ver,Health,2024-11-10
1gngi9t,RFK Jr.’s plan to ban fluoridation? Work’s already underway,137,392,0.94,politico.com,0,False,newzee1,Health,2024-11-09
1gnccw3,Scary study finds over 1 billion young people are at risk of hearing loss for one reason,60,331,0.93,bgr.com,1,False,BothZookeepergame612,Health,2024-11-09
1gnmjnr,Association Between Alzheimer's Disease and Herpes,7,71,0.97,herpescureadvocacy.com,1,False,Away_Repair7421,Health,2024-11-09
1gnepde,A ‘Crazy’ Idea for Treating Autoimmune Diseases Might Actually Work,5,68,0.91,theatlantic.com,0,False,newzee1,Health,2024-11-09
1gnm1ig,Opinion | A.I. Companions and the Mental Health Risks for the Young (Gift Article),1,10,0.83,nytimes.com,0,False,nytopinion,Health,2024-11-09
1gmz2fx,‘Exciting’ new lupus treatment could end need for lifelong medication,4,249,0.99,theguardian.com,0,False,miolmok,Health,2024-11-09
1gna1en,How to create a dopamine menu to combat fall and winter blues. ,0,5,0.73,cbsnews.com,0,False,UncoveringScandals90,Health,2024-11-09
1gmootg,Federal judge’s ruling to reduce fluoride levels in drinking water despite ‘scarce’ research may help fuel RFK Jr.’s ‘wild’ crusade,39,200,0.88,lawandcrime.com,0,False,tasty_jams_5280,Health,2024-11-08
1gmb7ol,Millions at risk of losing health insurance after Trump's victory,343,1361,0.89,nbcnews.com,0,False,newzee1,Health,2024-11-08
1gmmy2g,What Trump and Robert F. Kennedy Jr. might do to undermine vaccines — and what they likely can’t,17,114,0.84,statnews.com,0,False,statnews,Health,2024-11-08
1gmokyu,Study maps how nonprofit religious groups set up facilities near abortion clinics,1,40,0.92,nbcnews.com,0,False,nbcnews,Health,2024-11-08
1gmfqd7,"After decades, FDA finally moves to pull ineffective decongestant off shelves | Last year, FDA advisors unanimously voted that oral phenylephrine is ineffective.",5,75,0.97,arstechnica.com,0,False,chrisdh79,Health,2024-11-08
1gmgbgc,TB reclaims title of deadliest infectious disease. That's an 'outrage' says WHO,0,65,0.95,npr.org,0,False,Maxcactus,Health,2024-11-08
1glvaea,Americans stockpile abortion pills and hormones ahead of ‘reproductive apocalypse’ under Trump,199,1359,0.94,theguardian.com,0,False,poltrudes,Health,2024-11-07
1gmeegn,Seem like peanut allergies were once rare and now everyone has them?,15,61,0.88,news.harvard.edu,1,False,F0urLeafCl0ver,Health,2024-11-08
1gmfj08,Swiss researchers find unwanted CRISPR side effects,1,41,0.94,swissinfo.ch,0,False,Realistic-Lie-8031,Health,2024-11-08
1gm7r68,"Compounded semaglutide associated with at least 10 deaths, Novo Nordisk CEO warns",21,153,0.87,cnn.com,0,False,cnn,Health,2024-11-08
1gm3j7c,America Has an Onion Problem,38,182,0.92,theatlantic.com,0,False,theatlantic,Health,2024-11-07
1gluqc8,"FDA proposes ending use of decongestant found in many cold, allergy medicines",49,304,0.98,cnbc.com,0,False,cnbc_official,Health,2024-11-07
1glxw7c,It's Safe to Get the COVID-19 and Flu Shots at the Same Time,43,71,0.83,time.com,0,False,timemagazine,Health,2024-11-07
1glpl40,Best fluoride alternatives if it's removed from water?,201,184,0.85,nbcnews.com,0,False,nesp12,Health,2024-11-07
1glzrod,"Bird flu infections in farmworkers are going undetected, study shows",3,47,0.97,statnews.com,1,False,statnews,Health,2024-11-07
1gloctg,Robert F. Kennedy Jr.’s “Make America Healthy Again” Draws Wellness Influencers to MAGA,75,183,0.88,motherjones.com,1,False,newzee1,Health,2024-11-07
1gm17rq,Inside the Company Helping America’s Biggest Health Insurers Deny Coverage for Treatments,0,25,0.93,propublica.org,0,False,rustyseapants,Health,2024-11-07
1glun1n,"Toddler’s Snakebite Treatment Costs Family $297,000 | A recent report highlights how hospitals will often egregiously mark up the costs of antivenom.",3,26,0.85,kffhealthnews.org,0,False,chrisdh79,Health,2024-11-07
1glov2d,'Forever chemicals' linked to gut and kidney damage in young adults,0,57,0.97,euronews.com,0,False,euronews-english,Health,2024-11-07
1glo0nx,"Sugar in the first 1,000 days after conception linked to health issues later in life, study say",8,60,0.91,cnn.com,0,False,,Health,2024-11-07
1glujse,Energy drinks may be damaging your heart,11,19,0.77,futurity.org,0,False,Snowfish52,Health,2024-11-07
1glqdkq,"Moderna posts surprise profit as Covid vaccine sales impress, cost cuts take hold",3,32,0.86,cnbc.com,0,False,cnbc_official,Health,2024-11-07
1gl5e6y,"After Trump win, RFK Jr. says he won't 'take away anybody’s vaccines'",182,952,0.95,nbcnews.com,0,False,nbcnews,Health,2024-11-06
1gltaz1,"Sleepy during the day? You may be at higher risk for a pre-dementia syndrome, study finds",3,12,0.8,ctvnews.ca,0,False,CTVNEWS,Health,2024-11-07
1gl78sz,States’ Abortion Rights Wins May Be Short-Lived Under a Second Trump Term,71,426,0.93,wired.com,0,False,wiredmagazine,Health,2024-11-06
1gla05e,5 ways Trump’s presidential win could change U.S. health care,78,197,0.91,globalnews.ca,0,False,globalnewsca,Health,2024-11-06
1glrb3o,Pedaling Towards Happiness: 7 Mental Health Benefits of Riding Bikes,0,11,0.87,momentummag.com,0,False,Generalaverage89,Health,2024-11-07
1glc31w,"Sleepy during the day? You may be at higher risk for a pre-dementia syndrome, study finds",10,87,0.91,cnn.com,1,False,cnn,Health,2024-11-06
1glnzc4,"Preterm births linked to lower income, employment and education in adulthood, study finds",0,8,0.79,euronews.com,0,False,euronews-english,Health,2024-11-07
1glsxkz,Inside Canada's chaotic response to bird flu,0,3,0.64,ctvnews.ca,0,False,CTVNEWS,Health,2024-11-07
1gl6e0b,Higher omega-3 and omega-6 levels associated with lower rates of cancer,1,95,0.99,news.uga.edu,0,False,universityofga,Health,2024-11-06
1glwr03,"James Van Der Beek of ‘Dawson’s Creek’ Reveals He Has Colon Cancer, Diagnosis Highlights Alarming Trend in Young People",0,1,1.0,healthline.com,0,False,healthline,Health,2024-11-07
1gkvzm1,"Abortion rights ballot measures pass in 7 states, fail in 3 others",11,241,0.97,nbcnews.com,0,False,nbcnews,Health,2024-11-06
1gl41tp,"The post-Roe effort to protect abortion rights hits its limit, for now",1,68,0.96,statnews.com,0,False,statnews,Health,2024-11-06
1gl17xj,U.K. doctor gets 31 years for poisoning mother's partner with fake COVID vaccine,2,95,0.97,ctvnews.ca,0,False,CTVNEWS,Health,2024-11-06
1gl08ut,Eye health: Eating 2 ounces of pistachios daily may help,4,33,0.97,medicalnewstoday.com,0,False,ChocoMuchacho,Health,2024-11-06
1gkh3ax,Pfizer Accused of Hiding Birth Control Drug's Brain Tumor Link,16,508,0.98,news.bloomberglaw.com,0,False,bloomberglaw,Health,2024-11-05
1glau47,Mindfulness meditation with Jon Kabat-Zinn,2,0,0.5,cbc.ca,0,False,sparki_black,Health,2024-11-06
1gkhh09,Opinion | Election Uncertainty Has Broken Our Brains (Gift Article),2,53,0.89,nytimes.com,0,False,nytopinion,Health,2024-11-05
1gjrfam,RFK Jr. and Trump want fluoride out of water. What does the mineral do?,226,694,0.94,globalnews.ca,1,False,globalnewsca,Health,2024-11-04
1gjosec,"Seven Hours of Sleep Is the New Eight, Expert Says",62,308,0.87,healthnews.com,0,False,SscorpionN08,Health,2024-11-04
1gjn1u0,A ‘Crazy’ Idea for Treating Autoimmune Diseases Might Actually Work,20,372,0.98,theatlantic.com,1,False,theatlantic,Health,2024-11-04
1gjqqi8,The Deaths and Agonies of Trump’s Abortion Bans,1,189,0.96,nymag.com,0,False,marji80,Health,2024-11-04
1gjk68u,"Sugar in the first 1,000 days after conception linked to health issues later in life, study says",15,277,0.91,cnn.com,1,False,cnn,Health,2024-11-04
1gk2ht7,"Europe's food supply will be impacted by Spain's floods, warn experts",0,13,0.77,euronews.com,0,False,boppinmule,Health,2024-11-05
1gjn4vp,Is election anxiety keeping you awake? Sleep experts share advice,25,119,0.92,scientificamerican.com,0,False,scientificamerican,Health,2024-11-04
1gji7re,'Changed my life': This Canadian woman was struggling with multiple chronic health problems. A diabetes program changed everything,10,183,0.96,ctvnews.ca,0,False,CTVNEWS,Health,2024-11-04
1gjjtc9,Opinion | Doctors Should Have to Report Medically Impaired Drivers (Gift Article),23,89,0.85,nytimes.com,0,False,nytopinion,Health,2024-11-04
1gjitds,Winter depression is real and there are many ways to fight back,4,56,0.9,ctvnews.ca,0,False,CTVNEWS,Health,2024-11-04
1gj7ll2,"Scientists glue two proteins together, driving cancer cells to self-destruct",12,347,0.99,med.stanford.edu,0,False,Snowfish52,Health,2024-11-04
1gjegba,"New magnetoelastic sensor within a stent transmits information about potential bile blockages,",0,18,0.93,ece.engin.umich.edu,0,False,mareacaspica,Health,2024-11-04
1gip725,Scientists found a new way to make cancer cells self-destruct,13,524,1.0,bgr.com,0,False,BothZookeepergame612,Health,2024-11-03
1giw6fv,Presidential candidates silent on opioid crisis beyond ‘war on drugs’ rhetoric: ‘It’s easier to point fingers,20,107,0.91,theguardian.com,0,False,shinybrighthings,Health,2024-11-03
1gibzm9,"Dentists Are Pulling ‘Healthy’ and Treatable Teeth To Profit From Implants, Experts Warn ",65,687,0.97,kffhealthnews.org,0,False,mcgillhufflepuff,Health,2024-11-03
1giiz54,"Toxic PFAS in menstrual pads harm reproductive health, advocates says",3,150,0.98,theguardian.com,0,False,rhs314,Health,2024-11-03
1gjc3m5,AI chatbot blamed in teen's death: Here's what to know about AI's psychological risks and prevention,0,1,1.0,euronews.com,0,False,euronews-english,Health,2024-11-04
1giui2r,Govt shuts primary schools in Lahore over record pollution,1,19,0.91,dawn.com,0,False,boppinmule,Health,2024-11-03
1gicemb,"In a 1st, scientists reversed type 1 diabetes by reprogramming a person's own fat cells | Live Science",4,294,1.0,livescience.com,0,False,Southern_Opposite747,Health,2024-11-03
1gicexo,Largest cancer atlas to date brings new treatments for incurable tumors closer,0,92,1.0,english.elpais.com,0,False,DoremusJessup,Health,2024-11-03
1gi7n78,Mother warns about SUDEP after son’s death,5,66,0.95,katu.com,0,False,sullie363,Health,2024-11-02
1ghuc8q,Everything you ever wanted to know about vaginas … but were too afraid to Google,28,247,0.89,theguardian.com,0,True,F0urLeafCl0ver,Health,2024-11-02
1ghv3cz,Can retraining the brain help silence tinnitus? Some scientists are trying to find out,18,121,0.98,cbc.ca,1,False,sparki_black,Health,2024-11-02
1gi5rua,Watch: Herald investigation reveals illegal $3 cigarettes sold in Auckland dairies,0,22,0.89,nzherald.co.nz,0,False,boppinmule,Health,2024-11-02
1ghq8fd,An Idaho health department isn't allowed to give COVID-19 vaccines anymore. Experts say it's a first,5,132,0.96,apnews.com,0,False,marji80,Health,2024-11-02
1gh9h49,A Pregnant Teenager Died After Trying to Get Care in Three Visits to Texas Emergency Rooms,149,971,0.97,propublica.org,0,False,Exastiken,Health,2024-11-01
1ghu7fw,An 'unprecedented' good news story about a potentially deadly viral outbreak,0,25,0.88,npr.org,0,False,Maxcactus,Health,2024-11-02
1ghtlc1,"Endocrine disruptors, the invisible chemicals that trigger disease",1,23,0.9,english.elpais.com,0,False,miolmok,Health,2024-11-02
1ghdl5a,RFK Jr. Is Already Preparing to Take Over Federal Health Agencies,54,376,0.95,rollingstone.com,0,False,indig0sixalpha,Health,2024-11-01
1ghaf4u,Texas hospitals must now ask patients whether they’re in the US legally.,294,494,0.95,cnn.com,1,False,mattv911,Health,2024-11-01
1ghf8zt,"A quarter of pediatric deaths at hospitals are preventable, study finds",3,169,0.98,independent.co.uk,0,False,theindependentonline,Health,2024-11-01
1ghcumv,Trump team fully embraces RFK Jr.'s vaccine skepticism,22,213,0.92,nbcnews.com,0,False,nbcnews,Health,2024-11-01
1ghfco5,Salad recall in five states over allergen fears,1,52,0.97,newsweek.com,0,False,newsweek,Health,2024-11-01
1gh7qx2,Children's doctors reporting unusual increase in walking pneumonia cases in Canada,7,115,0.97,ctvnews.ca,0,False,CTVNEWS,Health,2024-11-01
1gh88wq,"Bird flu spreading faster than 2023 in the EU, data shows",0,47,0.97,ctvnews.ca,0,False,CTVNEWS,Health,2024-11-01
1gglbbv,Trump transition official says RFK Jr. wants to force vaccines off the market,136,1042,0.94,thehill.com,2,False,marji80,Health,2024-10-31
1ggnvdj,"Parents are putting more trust into ChatGPT than actual doctors, study finds",55,258,0.95,independent.co.uk,0,False,theindependentonline,Health,2024-10-31
1ggk46x,"Giving birth to triplets, quadruplets or even more has become increasingly less common in the United States",12,248,0.97,cnn.com,0,False,cnn,Health,2024-10-31
1ggmpyd,RFK Jr. Wants to Reshape US Health Policy. Good Luck With That,60,155,0.87,wired.com,0,False,wiredmagazine,Health,2024-10-31
1ggjncl,What alarms health experts most about RFK Jr. is what he’s leaving out of his health policy proposals,4,105,0.9,cnn.com,0,False,newzee1,Health,2024-10-31
1ggdhbd,Nearly 6% of pregnant women report marijuana use,47,169,0.91,news.uga.edu,0,False,universityofga,Health,2024-10-31
1ggm1bq,Limiting sugar in infancy reduces the risk of diabetes and hypertension | Children who experienced sugar rationing during WWII were less likely to develop chronic illnesses,2,45,0.96,sciencenews.org,0,False,Science_News,Health,2024-10-31
1ggi25b,"On the topic of ""French press coffee is bad for you"" - coffee filtered with a metal filter will cause a minor increase in LDL",9,65,0.9,voltagecoffee.com,0,False,ryhaltswhiskey,Health,2024-10-31
1ggakzs,Shortage of IV fluids leads to canceled surgeries,8,175,0.97,npr.org,0,False,Maxcactus,Health,2024-10-31
1ggagml,Bird flu has been found in a pig for the first time in the U.S.,5,112,0.98,npr.org,0,False,Maxcactus,Health,2024-10-31
1gfqc6t,A Texas Woman Died After the Hospital Said It Would be a “Crime” to Intervene in Her Miscarriage,102,1233,0.96,propublica.org,0,False,Exastiken,Health,2024-10-30
1gfr61y,Throw Out Your Black Plastic Spatula,128,641,0.98,theatlantic.com,0,False,theatlantic,Health,2024-10-30
1gg9bn7,Opinion | What We Lose When Pharmacists Are Forced to Act Like Cops (Gift Article),2,34,0.9,nytimes.com,0,False,nytopinion,Health,2024-10-31
1gflh0q,RFK Jr. Says Trump Promised Him 'Control' Of CDC And Other Health Agencies,112,911,0.96,huffpost.com,0,False,asdtyyhfh,Health,2024-10-30
1gga264,EU agency finds banned chemicals in some 6% of cosmetics – DW – 10/30/2024,3,19,0.93,dw.com,0,False,boppinmule,Health,2024-10-31
1gfw154,CDC says slivered onions are likely cause of McDonald's E. coli infections as cases rise to 90,2,99,0.99,nbcnews.com,0,False,nbcnews,Health,2024-10-30
1gft8m0,H5N1 bird flu detected in pig for the first time in the US,6,110,0.97,telegraph.co.uk,0,False,TheTelegraph,Health,2024-10-30
1gfozhx,Quarter pounder leads to teen's kidney failure,23,181,0.94,ctvnews.ca,0,False,CTVNEWS,Health,2024-10-30
1gfupvp,Why Dirt Is Good For Kids — And Could Lead To A Healthier Adulthood,11,79,0.96,inverse.com,0,False,mareacaspica,Health,2024-10-30
1gfuj79,"Bird flu found in a pig in U.S. for the first time, raising concerns about potential risks to humans",5,80,0.95,statnews.com,0,False,statnews,Health,2024-10-30
1ggk55d,"Your Questions About Open Enrollment, Answered",0,1,1.0,time.com,0,False,timemagazine,Health,2024-10-31
1ggeibh,Mucus: It’s Snot What You Think,1,1,1.0,nytimes.com,0,False,spike,Health,2024-10-31
1gfrn76,First case of dangerous new mpox strain confirmed in the UK,2,37,0.88,telegraph.co.uk,0,False,TheTelegraph,Health,2024-10-30
1gfhuro,Bird flu outbreak: Map reveals confirmed US human cases,16,159,0.97,newsweek.com,0,False,newsweek,Health,2024-10-30
1gfmh48,OpenAI’s Transcription Tool Hallucinates. Hospitals Are Using It Anyway,3,52,0.94,wired.com,0,False,wiredmagazine,Health,2024-10-30
1gfor5k,"Tuberculosis returns as top infectious disease killer, WHO says",1,27,0.92,reuters.com,0,False,sasko12,Health,2024-10-30
1gfmkak,Regular exercise may reduce death risks for new dementia patients,0,35,0.92,euronews.com,0,False,euronews-english,Health,2024-10-30
1geycg6,"These nuts may help prevent blindness in old age, reveals scientist",32,269,0.92,newsweek.com,1,False,newsweek,Health,2024-10-29
1ger75e,People opt out of organ donation programs after reports of a man mistakenly declared dead ,60,351,0.96,apnews.com,0,False,BobbyLucero,Health,2024-10-29
1geuta0,Lung cancer on the rise in U.S. Asian women who don't smoke. Experts hope to expand screenings.,5,176,0.98,cbsnews.com,0,False,CBSnews,Health,2024-10-29
1gey8dj,"Flu and COVID vaccination was way below target in 2023, ECDC says",1,42,0.95,euronews.com,0,False,euronews-english,Health,2024-10-29
1geaaun,Donald Trump Vows to Let Robert F. Kennedy Jr. ‘Go Wild on Health’ If Elected,164,923,0.95,wired.com,1,False,wiredmagazine,Health,2024-10-28
1geuacl,Exosomes are touted as a trendy cure-all. We don’t know if they work.,4,32,0.88,technologyreview.com,0,False,techreview,Health,2024-10-29
1gexp44,Clinical Conundrum:  severe eczema flare or topical steroid withdrawal?,0,8,1.0,pulsetoday.co.uk,0,False,Sisu-cat-2004,Health,2024-10-29
1ge4iyu,Why a group of Canadian doctors says workplace sick notes need to go,12,164,0.98,ctvnews.ca,0,False,CTVNEWS,Health,2024-10-28
1gdwf6t,"""Serious lung infection"" linked to cruise ship hot tubs, CDC finds",40,574,0.98,newsweek.com,0,False,newsweek,Health,2024-10-28
1gf0fzw,Poor Sleep In Your 40s Linked to Faster Brain Aging Later In Life,0,1,1.0,healthline.com,0,False,healthline,Health,2024-10-29
1ge8qxy,Toxic Inaction: Oakland's lead funding languishes as residents live with serious health risks,0,33,0.92,eltimpano.org,0,False,jms1225,Health,2024-10-28
1ge3od6,AI speeds up X-Ray diagnosis for broken bones,1,47,0.94,rollingout.com,0,False,BothZookeepergame612,Health,2024-10-28
1gdrlye,Opinion | No One Tells You What Happens to Your Muscles in Your 40s (Gift Article),44,272,0.95,nytimes.com,0,False,nytopinion,Health,2024-10-28
1gdj8eh,"Leading neurologists say evidence linking paraquat with Parkinson's disease is 'very strong', and they want it banned",79,740,0.99,abc.net.au,0,False,miolmok,Health,2024-10-27
1gdx0u5,Daylight saving ends in Europe this weekend. Experts warn the time change could harm your health,2,9,1.0,euronews.com,0,False,euronews-english,Health,2024-10-28
1gcwssd,Researchers say an AI-powered transcription tool used in hospitals invents things no one ever said,49,321,0.98,apnews.com,0,False,mcgillhufflepuff,Health,2024-10-26
1gcn63d,"Hack at UnitedHealth's tech unit impacted 100 mln people, US health dept says",6,141,0.98,reuters.com,0,False,F0urLeafCl0ver,Health,2024-10-26
1gcw04h,Are pumpkin seeds good for you? How to get a nutritional boost from your jack-o'-lantern.,1,31,0.95,usatoday.com,0,False,Specific-Ad7048,Health,2024-10-26
1gckadg,Does activated charcoal interact with medication?,8,63,0.92,livescience.com,0,False,TylerFortier_Photo,Health,2024-10-26
1gc4ggx,"Active ingredient in Ozempic, Wegovy may reduce risk of Alzheimer's disease: Study",40,489,0.96,abcnews.go.com,1,False,gordon22,Health,2024-10-25
1gcgr55,Anti-malarial drug resistance is making malaria normal again,1,41,0.97,africanarguments.org,0,False,boppinmule,Health,2024-10-26
1gc8q94,What food safety experts steer clear of to avoid E. coli,15,67,0.95,nbcnews.com,0,False,nbcnews,Health,2024-10-26
1gbtbi5,One in 14 American Patients May Be Harmed by Hospital Diagnosis Mistakes,82,477,0.98,newsweek.com,0,False,chrisdh79,Health,2024-10-25
1gbyva5,Fried foods contain advanced glycation end products that are involved in atherosclerosis and lead to premature aging,9,216,0.98,theguardian.com,1,False,smitra00,Health,2024-10-25
1gbxauz,"McDonald's E. coli outbreak has sickened at least 75 people in 13 states, CDC says",31,189,0.98,cbsnews.com,0,False,CBSnews,Health,2024-10-25
1gbtywn,Map reveals 20% Americans at risk of 'forever chemicals' in drinking water,26,231,0.97,newsweek.com,0,False,newsweek,Health,2024-10-25
1gbvrni,"Teenagers are taking new weight-loss drugs, but the science is far from settled",43,138,0.98,scientificamerican.com,0,False,scientificamerican,Health,2024-10-25
1gbymtv,McDonald’s E. coli updates: Number of states with outbreak grows to 13,3,60,0.99,nbcchicago.com,0,False,progress18,Health,2024-10-25
1gbxe73,"Illnesses linked to McDonald's E. coli outbreak rise to 75, CDC says",0,34,0.98,nbcnews.com,0,False,nbcnews,Health,2024-10-25
1gc0s97,Iron-(Fe3+)-Dependent Reactivation of Telomerase Drives Colorectal Cancers,4,16,0.95,pubmed.ncbi.nlm.nih.gov,0,False,Maxcactus,Health,2024-10-25
1gbdnvr,Doctors Agreed Her Baby Would Die 3 Months Before She Was Forced to Give Birth,30,592,0.97,rollingstone.com,0,False,newzee1,Health,2024-10-24
1gc21dl,DEA’s National Prescription Drug Take Back Day. On this webpage are resources to help you dispose of unneeded medications in your home ,0,5,1.0,dea.gov,0,False,jms1225,Health,2024-10-25
1gbefyc,"McDonald's E.Coli outbreak leads Burger King, KFC, Pizza Hut to remove onions from some locations",8,145,0.97,cbsnews.com,0,False,CBSnews,Health,2024-10-24
1gba7bv,Drinking is cheaper than it’s been in decades. Lobbyists are fighting to keep it that way,65,242,0.96,statnews.com,0,False,statnews,Health,2024-10-24
1gbdvxm,This Essential Health Care Program Could Get Hammered If Donald Trump Wins,18,143,0.89,huffpost.com,0,False,newzee1,Health,2024-10-24
1gb5xui,McDonald’s hit with lawsuit after deadly E. coli outbreak,14,253,0.98,globalnews.ca,0,False,globalnewsca,Health,2024-10-24
1gbe036,Opinion | Abortion Pills Are Safe. Post-Roe America Isn’t. (Gift Article),2,57,0.89,nytimes.com,0,False,nytopinion,Health,2024-10-24
1gb4h8q,FDA eyes McDonald's supplier Taylor Farms as source of E. Coli outbreak,17,184,0.98,nbcnews.com,0,False,nbcnews,Health,2024-10-24
1gbc37c,This radioactive gas is a leading cause of lung cancer. Here's how to check if it's in your home,21,66,0.83,ctvnews.ca,0,False,CTVNEWS,Health,2024-10-24
1gb7z37,McDonald's pulls Quarter Pounders from one-fifth of U.S. stores after E. coli outbreak,8,52,0.95,cbc.ca,0,False,progress18,Health,2024-10-24
1gb1aim,Human space travel could pose more severe health risks finds new report,1,51,0.96,spacedaily.com,0,False,solid_boss55,Health,2024-10-24
1gb8w9x,Human bird flu cases in California may be undercounted as workers resist testing,0,15,0.9,reuters.com,1,False,Randomlynumbered,Health,2024-10-24
1gb254n,Inside the Company Helping America’s Biggest Health Insurers Deny Coverage for Treatments,5,24,0.92,propublica.org,0,False,rytis,Health,2024-10-24
1gaopud,McDonald's zeroes in on onions as the likely source of deadly E. coli outbreak,36,289,0.97,nbcnews.com,2,False,nbcnews,Health,2024-10-23
1gav1jb,"People 50 and older should get pneumococcal vaccine, U.S. health officials recommend",19,84,0.92,apnews.com,0,False,duderos,Health,2024-10-24
1gb3byx,How to spot early signs of potentially fatal whooping cough as cases rise,0,14,0.95,newsweek.com,1,False,newsweek,Health,2024-10-24
1gak88b,"More couples are engaging in viral ‘sleep divorce’ trend on vacation, study finds",65,305,0.92,independent.co.uk,0,False,theindependentonline,Health,2024-10-23
1gaxrke,Research shows coffee could increase cholesterol levels in blood,13,34,0.79,getsurrey.co.uk,1,False,SubstantialSnow7114,Health,2024-10-24
1gb508x,Why Do People Sleepwalk?,6,8,0.83,time.com,0,False,timemagazine,Health,2024-10-24
1gac5xe,The Maker of Ozempic Is Trying to Block Compounded Versions of Its Blockbuster Drug,82,453,0.97,wired.com,0,False,wiredmagazine,Health,2024-10-23
1gb4wpw,New AI tool that can predict death to be trialled on heart patients,2,5,1.0,euronews.com,0,False,euronews-english,Health,2024-10-24
1gaxrkn,"New Alzheimer’s drug approved in UK, but government won’t pay for it",10,11,0.88,euronews.com,0,False,euronews-english,Health,2024-10-24
1gaim2e,CDC told McDonald's about potential E. coli outbreak late last week,5,136,0.97,cnbc.com,0,False,cnbc_official,Health,2024-10-23
1gaibqv,“Not Medically Necessary”: Inside the Company Helping America’s Biggest Health Insurers Deny Coverage for Care,3,78,0.96,propublica.org,0,False,zsreport,Health,2024-10-23
1gaeawv,Early research suggested long COVID didn't affect children. New studies say that's not true,2,100,0.98,ksl.com,0,False,ajb160,Health,2024-10-23
1gaforz,Study busts myths about cause of gout,11,74,0.95,otago.ac.nz,1,False,F0urLeafCl0ver,Health,2024-10-23
1ga3er6,"Your Morning Coffee Could Be Quietly Causing Hearing Loss, Study Reveals",139,305,0.85,headphonesty.com,2,False,ChocoMuchacho,Health,2024-10-23
1gacud3,High Levels of Banned PFAS Detected in Hershey’s Packaging | Independent Tests Reveal Widespread Presence of Cancer-Linked “Forever Chemicals” in its Biggest Brands,3,51,0.97,grizzlyreports.com,0,False,chrisdh79,Health,2024-10-23
