id,title,num_comments,score,upvote_ratio,domain,num_crossposts,nsfw,author,subreddit,date
1h13uv0,"Billions of people suffer from anemia, but there are cheap ways to reduce this",2,24,1.0,ourworldindata.org,1,False,F0urLeafCl0ver,Health,2024-11-27
1h0uuxq,Wildfire Smoke Linked to Increased Risk of Dementia,6,92,0.97,scientificamerican.com,0,False,Splenda,Health,2024-11-27
1h0v6h7,Reducing Abdominal Fat: Researchers Uncover Surprising Health Benefits of Maple Syrup,28,76,0.72,scitechdaily.com,0,False,cuspofgreatness,Health,2024-11-27
1h0gfjj,Everyone Agrees Americans Aren’t Healthy,91,477,0.98,theatlantic.com,0,False,theatlantic,Health,2024-11-26
1h0oint,"Vaping immediately affects vascular health and oxygen levels, study shows, even without nicotine",15,75,0.9,cnn.com,0,False,cnn,Health,2024-11-26
1h0dxp6,Medication prescribed to 23 million Americans may cause bone loss,37,211,0.95,newsweek.com,0,False,newsweek,Health,2024-11-26
1h08zrs,Biden Proposes Medicare and Medicaid Coverage of Obesity Drugs ,51,321,0.97,bloomberg.com,0,False,DomesticErrorist22,Health,2024-11-26
1h1222u,What's next for Amgen obesity drug after investors disappointed by results,2,1,0.6,newsweek.com,0,False,newsweek,Health,2024-11-27
1h0bpc1,Meet the start-up working to save newborn babies and democratize pregnancy care,1,39,0.91,cnbc.com,0,False,cnbc_official,Health,2024-11-26
1gzqe1n,A Third Woman Died Under Texas’ Abortion Ban. Doctors Are Avoiding D&Cs and Reaching for Riskier Miscarriage Treatments.,51,750,0.97,propublica.org,0,False,Exastiken,Health,2024-11-25
1h09aei,A recent survey has revealed the most common culprits behind sleepless nights,13,33,0.79,newsweek.com,0,False,newsweek,Health,2024-11-26
1h04zg8,"Opinion | If My Dying Daughter Could Face Her Mortality, Why Couldn’t the Rest of Us? (Gift Article)",11,56,0.82,nytimes.com,0,False,nytopinion,Health,2024-11-26
1h10zqa,Opinion | I’m a Couples Therapist. We Can Address Our Political Divide. (Gift Article),2,0,0.35,nytimes.com,0,False,nytopinion,Health,2024-11-27
1gzu3d7,There’s a reason so many Americans trust RFK Jr. and Dr. Oz,169,116,0.68,msnbc.com,1,False,msnbc,Health,2024-11-25
1h0bvde,Biotechnology Company Receives $14 Million NIH Grant for Clinical Development of Novel Opioid with Overdose Protection,2,6,0.87,finance.yahoo.com,0,False,RoloBoat,Health,2024-11-26
1gzgsd4,"Learning CPR on manikins without breasts puts women’s lives at risk, study finds",62,418,0.95,theguardian.com,0,False,newzee1,Health,2024-11-25
1h05681,"Opinion | Overcoming Obesity, With Diet and Physical Education (Gift Article)",6,11,0.92,nytimes.com,0,False,nytopinion,Health,2024-11-26
1gzltgy,"PFAS and microplastics become more toxic when combined, research shows",3,114,0.99,theguardian.com,0,False,DomesticErrorist22,Health,2024-11-25
1gzdmbr,Antibiotic warning issued amid rise in global use,27,194,0.99,newsweek.com,0,False,newsweek,Health,2024-11-25
1gz27i7,Salad topping recalled in 20 states over wheat allergen contamination,0,60,0.93,nbcnews.com,0,False,nbcnews,Health,2024-11-24
1gzm6j3,"Dozens of people in Canada have scurvy, and it's because of food",2,2,0.75,ctvnews.ca,0,False,CTVNEWS,Health,2024-11-25
1gxrnbp,"Vasectomies Rise 1,200% After Donald Trump Election Win",107,2223,0.97,newsweek.com,0,False,newzee1,Health,2024-11-23
1gy8msi,"Nonalcoholic Fatty Liver Disease (NAFLD): What Is It, Causes, and Lifestyle Interventions",15,99,0.96,foodrevolution.org,1,False,boppinmule,Health,2024-11-23
1gy1wct,"As many as 1 in 5 people won't lose weight with GLP-1 drugs, experts say",27,166,0.99,apnews.com,0,False,kwentongskyblue,Health,2024-11-23
1gya3ng,How Lincare Cashed In on the Disastrous Recall of Philips Breathing Machines — at the Expense of Patients,2,56,0.96,propublica.org,0,False,Exastiken,Health,2024-11-23
1gy5bc9,A look at how some of Trump's picks to lead health agencies could help carry out Kennedy's overhaul,0,19,0.89,apnews.com,0,False,DomesticErrorist22,Health,2024-11-23
1gyxk7g,The truth about salt: how to avoid one of the world’s biggest hidden killers,9,0,0.29,theguardian.com,0,False,F0urLeafCl0ver,Health,2024-11-24
1gxqh5d,"Trump Builds Health Team With FDA, Surgeon General Picks",36,109,0.91,bloomberg.com,0,False,Snowfish52,Health,2024-11-23
1gxndbb,Florida's surgeon general advises against adding fluoride to drinking water,51,183,0.91,nbcnews.com,0,False,nbcnews,Health,2024-11-23
1gxcege,"Life expectancy gap in U.S. widens to 20 years due to ""truly alarming"" health disparities, researchers say",27,551,0.99,cbsnews.com,0,False,cuspofgreatness,Health,2024-11-22
1gxvu24,Florida health official advises communities to stop adding fluoride to drinking water,9,26,0.91,npr.org,0,False,rustyseapants,Health,2024-11-23
1gxbous,"Mehmet Oz's controversial health claims, from the HCG diet to green coffee extract | Once called “America’s Doctor,” Donald Trump’s pick to head Medicare is now more known for dubious promotion of supplements and hormones unsupported by scientific evidence.",29,374,0.96,nbcnews.com,0,False,GoMx808-0,Health,2024-11-22
1gx8its,Trump's tariffs could raise the cost of generic drugs in the U.S.,31,278,0.95,nbcnews.com,0,False,nbcnews,Health,2024-11-22
1gxbk5y,6 tourists died in Laos after apparently drinking methanol. What is it and why was it in drinks?,8,123,0.97,ctvnews.ca,0,False,CTVNEWS,Health,2024-11-22
1gxcxq7,"US Tobacco Use Declines, But Smoking-Related Health Disparities Remain",1,18,0.89,healthline.com,0,False,healthline,Health,2024-11-22
1gwkbpy,Covid vaccine boosters rejected by majority of Americans,331,704,0.94,telegraph.co.uk,0,False,TheTelegraph,Health,2024-11-21
1gxj0sv,"Tracking respiratory viruses in Canada: RSV, influenza, COVID-19",1,3,0.71,ctvnews.ca,0,False,CTVNEWS,Health,2024-11-22
1gwonx3,"Solving a 40-year mystery, scientists ID chemical found in millions of Americans’ tap water",35,264,0.98,cnn.com,0,False,cnn,Health,2024-11-21
1gwqq59,Mehmet Oz loves promoting this inferior Medicare substitute,5,199,0.96,msnbc.com,0,False,msnbc,Health,2024-11-21
1gwoi2f,Conspiracy theorists are turning their attention back to HPV vaccines,55,223,0.93,newscientist.com,1,False,indig0sixalpha,Health,2024-11-21
1gwmbvp,"Over 160,000 pounds of ground beef recalled due to E. coli risk",63,246,0.99,nbcnews.com,0,False,nbcnews,Health,2024-11-21
1gx02rd,"Opinion | In America, if Everything Is a Public Health Crisis, Nothing Is (Gift Article)",1,22,0.89,nytimes.com,0,False,nytopinion,Health,2024-11-22
1gwk60q,RFK Jr. Has Made False and Dangerous Claims about AIDS. That Could Become a Global Problem. ,12,168,0.89,motherjones.com,0,False,mcgillhufflepuff,Health,2024-11-21
1gwqwvp,New bird flu cases in young people are raising concerns about mutating virus,5,52,0.95,scientificamerican.com,0,False,scientificamerican,Health,2024-11-21
1gx6yj1,Study links endometriosis to slightly higher chance of early death,0,3,0.71,euronews.com,0,False,euronews-english,Health,2024-11-22
1gwpuf0,Scurvy in Canada: Is the vitamin C deficiency disease making a comeback?,4,38,0.94,globalnews.ca,0,False,globalnewsca,Health,2024-11-21
1gwz5jq,E. coli cases continue to rise following St. Louis County outbreak,1,7,0.78,fox2now.com,0,False,Cranberry__Queen,Health,2024-11-22
1gwh1yl,Horrifying medical device malfunction: Abdominal implant erupts from leg,1,83,0.98,arstechnica.com,0,False,Sariel007,Health,2024-11-21
1gw228n,More than 200 cases of whooping cough reported in Arkansas ,54,453,0.99,kark.com,0,False,Geodestamp,Health,2024-11-20
1gvzbxo,RFK Jr. Said the Government May Have Planned COVID,95,396,0.92,thebulwark.com,0,False,Majano57,Health,2024-11-20
1gvup5g,Texas Lawmakers Push for New Exceptions to State’s Strict Abortion Ban After the Deaths of Two Women,15,333,0.98,propublica.org,0,False,Exastiken,Health,2024-11-20
1gvxqce,Daily Walks Could Add 11 Years to Your Life,3,108,1.0,healthline.com,0,False,healthline,Health,2024-11-20
1gvr7ih,"The stunning success of vaccines in America, in one chart",18,227,0.97,vox.com,0,False,rytis,Health,2024-11-20
1gvxh5o,"CVS, UnitedHealth, Cigna sue to block FTC case over insulin prices",1,50,0.91,cnbc.com,0,False,cnbc_official,Health,2024-11-20
1gvssb5,Nationwide recall of anxiety drug over life-threatening packaging error,9,83,0.98,newsweek.com,0,False,GoMx808-0,Health,2024-11-20
1gvxaf6,The Surprising Benefits of Talking Out Loud to Yourself,2,28,0.97,time.com,0,False,timemagazine,Health,2024-11-20
1gvmnj9,Internet use for people aged 50 or above linked to improved mental health,12,109,0.95,abc.net.au,0,False,miolmok,Health,2024-11-20
1gvwpga,Alcohol-mimicking drug found to ease voice spasm that RFK Jr has,5,25,0.81,bbc.com,0,False,Chadrasekar,Health,2024-11-20
1gvygbe,The Cancer Gene More Men Should Test For,2,17,0.85,theatlantic.com,0,False,theatlantic,Health,2024-11-20
1gvm9h4,Opinion | Vaccines Have Saved Millions of Lives. Kennedy Threatens That Success. (Gift Article),20,81,0.86,nytimes.com,0,False,nytopinion,Health,2024-11-20
1gv8boy,Trump picks TV personality and former Senate candidate Mehmet Oz to run Medicare and Medicaid agency,220,826,0.94,nbcnews.com,1,False,nbcnews,Health,2024-11-19
1gvdcsz,Mehmet Oz Backed Massive Change to Medicare That Would Impact Millions,78,385,0.97,newsweek.com,0,False,newzee1,Health,2024-11-20
1gvrj56,"Tom's of Maine toothpaste contained bacteria-contaminated water, FDA says",0,17,0.91,nbcnews.com,0,False,nbcnews,Health,2024-11-20
1gv7r38,"Tom's of Maine toothpaste made with bacteria-tainted water, FDA warns",18,328,0.98,cbsnews.com,0,False,indig0sixalpha,Health,2024-11-19
1gvrp0d,"Ex-eye bank workers say pressure, lax oversight led to errors",0,7,0.9,wyofile.com,0,False,AnnaBishop1138,Health,2024-11-20
1gvn5lg,Nationwide IV fluid shortage changing how hospitals manage patient hydration,0,17,0.85,npr.org,0,False,Maxcactus,Health,2024-11-20
1gv8x8x,Trump chooses TV doctor Mehmet Oz to lead Centers for Medicare and Medicaid Services,48,176,0.93,ctvnews.ca,0,False,CTVNEWS,Health,2024-11-19
1gvdbyi,Opinion | The U.S. Response to Bird Flu is Not Reassuring the World (Gift Article),4,95,0.95,nytimes.com,0,False,nytopinion,Health,2024-11-20
1gw0627,Trump transition closes in on picks for top health posts,1,3,0.62,politico.com,0,False,Majano57,Health,2024-11-20
1gvozof,California child tests positive for bird flu with no known exposure to infected animals,2,8,0.75,nbcnews.com,0,False,progress18,Health,2024-11-20
1gvt71c,Italy spent over €1 billion on dozens of ‘drugs to avoid’ in 2022,0,4,0.7,euronews.com,0,False,euronews-english,Health,2024-11-20
1gv1hxc,Here’s How We Know RFK Jr. Is Wrong About Vaccines,43,218,0.82,theatlantic.com,0,False,theatlantic,Health,2024-11-19
1gvamh1,Survivor of suicide attempt receives innovative face transplant: ‘It was just a miracle’,9,63,0.9,cnn.com,0,False,cnn,Health,2024-11-19
1gv3g1j,How Wisconsin Lost Control of the Strange Disease Killing Its Deer,5,98,0.99,thenation.com,0,False,D-R-AZ,Health,2024-11-19
1gvloyy,Could salmonella help fight bowel cancer?,0,6,0.87,news.stv.tv,0,False,F0urLeafCl0ver,Health,2024-11-20
1gv3ft3,Concussions are remarkably common and can cause long-term problems,5,58,0.96,scientificamerican.com,0,False,scientificamerican,Health,2024-11-19
1gv2vi8,How UnitedHealth’s Playbook for Limiting Mental Health Coverage Puts Countless Americans’ Treatment at Risk,3,33,0.95,propublica.org,0,False,Exastiken,Health,2024-11-19
1gv0gwc,Bird flu in Canada may have mutated to become more transmissible to humans,7,34,0.9,theguardian.com,0,False,sorryDontUnderstand,Health,2024-11-19
1gunkte,"Sitting too much linked to heart disease –– even if you work out, according to new study",36,261,0.96,cnn.com,0,False,cnn,Health,2024-11-19
1guxkv5,'UTI vaccine treats recurrent infections,1,33,0.91,abc.net.au,0,False,Maxcactus,Health,2024-11-19
1guht6p,Doctors worry about RFK Jr’s anti-Ozempic stance (and many of his other views),168,571,0.9,independent.co.uk,0,False,theindependentonline,Health,2024-11-18
1guki2h,"Caroline Kennedy, a U.S. ambassador, says her cousin RFK Jr. holds 'dangerous' views on vaccines",17,375,0.93,nbcnews.com,0,False,nbcnews,Health,2024-11-19
1gv55ig,"Child in California treated for possible bird flu, state health department says | CNN",1,7,0.77,cnn.com,0,False,Cranberry__Queen,Health,2024-11-19
1gutr0d,Alzheimer's: Scientists analyze body fluid to find new drugs for disease,3,32,0.9,newsweek.com,0,False,newsweek,Health,2024-11-19
1gv1k4j,"NMN Ban Is Paused, FDA Won't Prioritize Enforcement Over Sales",1,9,1.0,healthnews.com,0,False,SscorpionN08,Health,2024-11-19
1guzv1i,Organic carrots recalled in Canada due to E. coli,0,4,0.71,ctvnews.ca,0,False,CTVNEWS,Health,2024-11-19
1guaeu1,RFK Jr. Fuels Uncertainty on Policies From Medicare to Abortion,18,181,0.94,news.bloomberglaw.com,0,False,newzee1,Health,2024-11-18
1gubf97,Canada's national lab confirms H5N1 in hospitalized teen,7,133,0.98,cidrap.umn.edu,0,False,Cranberry__Queen,Health,2024-11-18
1gugdns,How RFK Jr. could impact vaccines as Trump's HHS secretary,7,61,0.88,cbsnews.com,0,False,CBSnews,Health,2024-11-18
1guauu7,Nearly 500 soldiers quarantined at army camp due to flu outbreak,10,112,0.98,adaderana.lk,0,False,Cranberry__Queen,Health,2024-11-18
1gupy8m,Opinion | The Declining Population Argument Against Abortion Returns (Gift Article),9,12,0.78,nytimes.com,0,False,nytopinion,Health,2024-11-19
1gv2i5v,Consequences beyond acute SARS-CoV-2 infection in children,0,1,0.67,science.org,0,False,YouLiveOnASpaceShip,Health,2024-11-19
1gul1hx,H5N1 bird flu virus in Canadian teenager displays mutations demonstrating virus’ risk,2,14,0.74,statnews.com,0,False,statnews,Health,2024-11-19
1gtxmwp,"RFK Jr’s vaccine views ‘dangerous’, cousin Caroline Kennedy warns Australian audience",15,364,0.91,theguardian.com,0,False,GoMx808-0,Health,2024-11-18
1gv7fiu,Startling Study Links Cannabis Use to Genetic Damage and Cancer,11,0,0.38,scitechdaily.com,0,False,lurker_bee,Health,2024-11-19
1gtus84,RFK perpetuating obesity stigma and GLP-1 misinformation,172,483,0.84,cnn.com,0,False,Mountain-Science4526,Health,2024-11-18
1gu0rfz,Fact-checking RFK Jr's views on health policy,22,82,0.85,bbc.com,0,False,F0urLeafCl0ver,Health,2024-11-18
1gu7r6z,It’s actually healthier to enjoy holiday foods without the anxiety,0,22,0.86,scientificamerican.com,0,False,scientificamerican,Health,2024-11-18
1gtxa81,E. coli outbreak linked to organic carrots sickens people in 18 states,12,163,0.97,npr.org,0,False,METALLIFE0917,Health,2024-11-18
1gu34qr,Organic Carrot Recall in 18 states due to E. coli ,5,21,0.85,npr.org,0,False,RaindropsAndCrickets,Health,2024-11-18
1gu2j6n,"EU isn’t cutting antibiotic use fast enough, health agency says",4,19,0.86,euronews.com,0,False,euronews-english,Health,2024-11-18
1gu725o,Systematic review identifies most efficient regimen for obesity management is a combination of strength + endurance exercise (a minimum 175 min per week) and a hypocaloric diet.,2,4,0.67,sciencedirect.com,0,False,H0w-1nt3r3st1ng,Health,2024-11-18
1gu1wsv,Is it the flu or is it COVID? One at-home test can tell you,1,13,0.85,npr.org,0,False,Maxcactus,Health,2024-11-18
1gtgfal,"When muscles work out, they help neurons to grow, a new study shows",14,233,0.99,news.mit.edu,0,False,BlitzOrion,Health,2024-11-17
1gtscfd,Opinion | Robert F. Kennedy Jr. Revealed What Is Missing in Public Health Messaging (Gift Article),35,44,0.75,nytimes.com,0,False,nytopinion,Health,2024-11-18
1gtsog4,Incorrect arm positioning can lead to false hypertension diagnoses: ‘We make mistakes in measuring blood pressure more often than not’,2,38,0.87,english.elpais.com,0,False,DoremusJessup,Health,2024-11-18
1gtyf3s,Mobile Dentistry: A Game Changer for Primary Schools in NSW!,2,10,1.0,bitemagazine.com.au,0,False,ClaraWells1,Health,2024-11-18
1gtvibn,Opinion | Taking Away the Car Keys: Is It the Doctor’s Duty? (Gift Article),6,10,0.7,nytimes.com,0,False,nytopinion,Health,2024-11-18
1gt35fn,Texas follows Louisiana’s lead to reclassify reproductive care drugs as controlled substances,53,707,0.96,lailluminator.com,0,False,newzee1,Health,2024-11-17
1gth0x6,"Are standing desks good for you? The answer is getting clearer. Whatever your office setup, the most important thing is to move.",3,27,0.8,arstechnica.com,0,False,Sariel007,Health,2024-11-17
1gt68zo,"H5N1 bird flu infects six more humans in California, Oregon ",10,172,0.99,latimes.com,0,False,thinkB4WeSpeak,Health,2024-11-17
1gsv128,Nutritionist explains why you’re probably eating way too much cheese.,135,344,0.89,news.harvard.edu,2,False,Sariel007,Health,2024-11-16
1gsmvym,Vaccine shows promise against aggressive breast cancer,15,503,0.99,medicine.washu.edu,0,False,F0urLeafCl0ver,Health,2024-11-16
1gsrhqt,New FDA rules for TV drug ads: Simpler language and no distractions,27,203,1.0,apnews.com,0,False,indig0sixalpha,Health,2024-11-16
1gsgbez,Prospect of RFK Jr. as head of HHS panics many in medical science community,22,226,0.94,science.org,0,False,Exastiken,Health,2024-11-16
1gsu8ln,The Health Benefits (and Downsides) of Watercress: The World’s Healthiest Vegetable,0,17,0.9,foodrevolution.org,0,False,boppinmule,Health,2024-11-16
1gs5t18,RFK Jr.’s to-do list to make America ‘healthy’ has health experts worried,205,547,0.91,cnn.com,0,False,cnn,Health,2024-11-15
1gs9t9i,CDC confirms Oregon’s first human case of bird flu,41,261,0.97,nbcnews.com,0,False,nbcnews,Health,2024-11-15
1gs4vxx,Cases of highly infectious and preventable measles surged across the globe by 20 percent last year,7,200,0.99,independent.co.uk,0,False,theindependentonline,Health,2024-11-15
1gs3ghg,"Measles cases rose 20% worldwide in 2023, per new report",8,181,0.98,statnews.com,0,False,statnews,Health,2024-11-15
1gs93pf,STI Epidemic Slows in US As New Syphilis and Gonorrhea Cases Fall,4,48,0.97,healthline.com,0,False,healthline,Health,2024-11-15
1gs4hbz,What Lee Zeldin’s Nomination Means for the EPA,6,45,0.93,wired.com,0,False,wiredmagazine,Health,2024-11-15
1gs5lui,Stress can disrupt memory and lead to needless anxiety,1,37,0.96,nature.com,0,False,rumianegar,Health,2024-11-15
1grtoqr,Opinion | Can America’s Health Survive Robert F. Kennedy Jr.? (Gift Article),45,126,0.83,nytimes.com,0,False,nytopinion,Health,2024-11-15
1gru3ix,The First Crispr Treatment Is Making Its Way to Patients,5,77,0.95,wired.com,0,False,wiredmagazine,Health,2024-11-15
1grm4dj,"Want to live an extra 5 years? Those over 40 should exercise like this every day, researchers say",87,341,0.94,cbsnews.com,1,False,wonderingsocrates,Health,2024-11-15
1grfl90,"Trump picks RFK Jr. , anti-vaccine activist, for Health and Human Services secretary",309,861,0.89,nbcnews.com,3,False,nbcnews,Health,2024-11-14
1grkkal,"Winter Haven commissioners vote to remove fluoride from water, citing RFK Jr.",97,208,0.93,wfla.com,0,False,newzee1,Health,2024-11-15
1grifuq,"With Trump coming into power, the NIH is in the crosshairs",29,212,0.97,npr.org,0,False,newzee1,Health,2024-11-14
1gr7zzq,"Americans Began Drinking More During the Pandemic, and They Haven’t Stopped",65,407,0.97,healthline.com,0,False,healthline,Health,2024-11-14
1grax9v,"FDA employees consider how to handle RFK Jr., including leaving",51,279,0.98,nbcnews.com,1,False,nbcnews,Health,2024-11-14
1grr44i,2 million seek treatment as smog chokes Punjab,4,20,0.93,dawn.com,0,False,boppinmule,Health,2024-11-15
1grecei,There’s bird flu in California wastewater. What’s next?,11,70,0.94,scientificamerican.com,0,False,scientificamerican,Health,2024-11-14
1gr7w2z,"Why do we feel better after a ""good cry""? An expert explains the science behind it.",13,55,0.88,cbsnews.com,1,False,CBSnews,Health,2024-11-14
1grfl0y,"A breakthrough cancer immunotherapy is now taking aim at autoimmune disease | CAR-T therapy is generating excitement for lupus, scleroderma, and other conditions as clinical trials expand",0,19,0.96,science.org,1,False,Exastiken,Health,2024-11-14
1gr67t9,Sleep Doctors Share the 1 Tip That's Changed Their Lives,14,62,0.93,time.com,0,False,timemagazine,Health,2024-11-14
1gqq82c,McDonald's deadly E. coli outbreak has now sickened more than 100 people,21,404,0.99,cbsnews.com,0,False,CBSnews,Health,2024-11-13
1gr6xec,What science really says on the link between organic food and health,5,15,0.76,lemonde.fr,0,False,LeMonde_en,Health,2024-11-14
1grelcz,Model-driven Heart Rate Estimation and Heart Murmur Detection based on Phonocardiogram,0,5,0.74,ieeexplore.ieee.org,0,False,Diazepam,Health,2024-11-14
1gqe27b,Robert F. Kennedy Jr. Reveals Plans to Fire 600 Federal Health Workers,261,1111,0.96,motherjones.com,0,False,newzee1,Health,2024-11-13
1gqozwr,Federal lab confirms B.C. teen is first to contract bird flu in Canada,8,112,0.97,globalnews.ca,0,False,globalnewsca,Health,2024-11-13
1gqg4in,"With a push from RFK Jr., baseless fears about fluoride go mainstream",110,316,0.89,statnews.com,0,False,statnews,Health,2024-11-13
1gqr8ns,Canadian teen's bird flu infection is not the version found in cows,0,29,0.9,statnews.com,0,False,statnews,Health,2024-11-13
1gqmpph,"8 Things You Should Do for Your Bones Every Day, According to Orthopedic Doctors",7,48,0.96,time.com,1,False,timemagazine,Health,2024-11-13
1gr7ghe,Over 800 million people have diabetes globally. What about in Europe?,1,1,1.0,euronews.com,0,False,euronews-english,Health,2024-11-14
1gq3h4a,Lunchables removed from national school lunch program,34,533,1.0,cnn.com,0,False,cnn,Health,2024-11-13
1gqbrw7,What happens when a vaccine skeptic leads health policy? Ask Florida,4,80,0.94,npr.org,0,False,Maxcactus,Health,2024-11-13
1gqc8be,"FDA Recalls Chronic Kidney Disease Medication Over Impurity Concerns | Nearly 300,000 bottles of the drug, named Cinacalcet, were recalled and given a Class II recall risk level by the FDA.",4,51,0.97,newsweek.com,0,False,chrisdh79,Health,2024-11-13
1gpxbfa,Teenager in critical condition with Canada’s first human case of bird flu,51,447,0.98,theguardian.com,0,False,sorryDontUnderstand,Health,2024-11-12
1gqkhuc,"Lizard spit can help detect a rare pancreatic tumor | A protein found in the saliva of Gila monsters can bind to certain cells in the pancreas, making it a potentially useful tracer for finding insulinomas",2,8,0.91,sciencenews.org,0,False,Science_News,Health,2024-11-13
1gprw6c,Genetic Discrimination Is Coming for Us All,54,478,0.96,theatlantic.com,2,False,theatlantic,Health,2024-11-12
1gqb229,Bone Marrow Donors Can Be Hard to Find. One Company Is Turning to Cadavers,1,17,0.95,wired.com,0,False,wiredmagazine,Health,2024-11-13
1gppzdq,"Don’t sit on the toilet for more than 10 minutes, doctors warn",88,332,0.96,cnn.com,1,False,Rivinstein,Health,2024-11-12
1gqccc9,Online yoga classes prove helpful for back pain in new study,1,9,0.85,npr.org,0,False,DonutBree,Health,2024-11-13
1gq9lmg,"Opinion | How to Talk About Fluoride, Vaccines and Raw Milk (Gift Article)",6,8,0.84,nytimes.com,0,False,nytopinion,Health,2024-11-13
1gpi8zm,Do you close the toilet lid when you flush? Bacteria from the loo could be reaching your toothbrush.,49,225,0.95,bbc.co.uk,0,False,uniofwarwick,Health,2024-11-12
1gqgqy4,Cell therapy shows promise in treating deadly childhood brain cancer,0,1,1.0,euronews.com,0,False,euronews-english,Health,2024-11-13
1gpphdw,"Americans started drinking more during the pandemic, and a new study shows that lasted for years",3,66,1.0,cbsnews.com,0,False,CBSnews,Health,2024-11-12
1gq70dp,Opinion | Light in the Shadow of a Diagnosis (Gift Article),1,5,1.0,nytimes.com,0,False,nytopinion,Health,2024-11-13
1gpo3up,Sudden syphilis retreat in gay men is most likely tied to preventive antibiotic use,2,41,0.93,nbcnews.com,0,False,nbcnews,Health,2024-11-12
1gpiszc,The Real Problem With Banning Masks at Protests,2,26,0.8,wired.com,0,False,wiredmagazine,Health,2024-11-12
1gozfvv,"Bleeding and in pain, a woman endured a harrowing wait for miscarriage care due to Georgia’s restrictive abortion law",74,575,0.92,cnn.com,1,False,cnn,Health,2024-11-11
1gpvi1n,Cutting-edge test uses DNA sequencing to yield diagnoses for some medical mysteries,0,3,0.72,nbcnews.com,0,False,nbcnews,Health,2024-11-12
1gptq8v,Mixed reality game may help kids be more active,1,7,1.0,news.uga.edu,0,False,universityofga,Health,2024-11-12
1gpqw7o,Crosslinking of Ly6a metabolically reprograms CD8 T cells for cancer immunotherapy,0,7,1.0,nature.com,0,False,Yogurt789,Health,2024-11-12
1gp45sj,Trump's Uncertain Health Plans,18,158,0.88,dcreport.org,0,False,Majano57,Health,2024-11-11
1goru3d,More young people are surviving cancer. Then they face a life altered by it,56,470,0.99,npr.org,0,False,zsreport,Health,2024-11-11
1goz7hb,This scientist treated her own cancer with viruses she grew in the lab,3,140,0.98,nature.com,0,False,F0urLeafCl0ver,Health,2024-11-11
1gov1gy,Just 5 More Minutes of Vigorous Exercise Per Day Could Help Lower Blood Pressure,7,173,0.99,healthline.com,0,False,healthline,Health,2024-11-11
1govb1x,Anti-aging enthusiasts are turning to the drug rapamycin to help extend their lives—can it work? A longevity doctor weighs in,9,66,0.88,cnbc.com,1,False,cnbc_official,Health,2024-11-11
1gosp63,First human case of bird flu detected in Canada,7,72,0.96,newsweek.com,0,False,newsweek,Health,2024-11-11
1goqeuc,Stanford Scientists Overturn Mendel’s Law With Cancer Discovery,7,100,0.99,scitechdaily.com,0,False,Maxcactus,Health,2024-11-11
1gotll8,Brain aging: Green Mediterranean diet may help slow brain shrinkage,0,50,0.97,medicalnewstoday.com,0,False,DonutBree,Health,2024-11-11
1go6fsv,RFK Jr.’s new bully pulpit sends public health shock waves,165,556,0.92,thehill.com,0,False,GoMx808-0,Health,2024-11-10
1gowexi,When Should I Go To the Doctor With Cold Symptoms?,5,3,0.59,time.com,0,False,timemagazine,Health,2024-11-11
